"skuId","shopId","productName","discountedPrice","originalPrice","rating","soldCount","createdAt"
2264360909,4696599,TANLE grip kamuflase keel tangan gel mengikat pita penebalan raket ker,60851.0,0.0,0.0,0,"2022-01-24 08:37:21.728 +00:00"
2264379007,982749,z Run Mouse Pad Dengan Bantalan Gel Pergelangan Tangan Desain Ergonomi,111066.0,0.0,0.0,0,"2022-01-24 08:37:25.145 +00:00"
2264565392,4696599,Mohamm Pulpen Gel 0.5mm Untuk Tanda Tangan / Sekolah / Kantor,43233.0,0.0,0.0,0,"2022-01-24 08:37:21.728 +00:00"
2264793202,7959680,FJ584 STARQQN Sarung Tangan Olahraga dengan 3D Shockproof Gel,69000.0,0.0,0.0,0,"2022-01-24 08:37:25.926 +00:00"
2264796773,7959680,DR738 CoolChange Sarung Tangan Sepeda Silicone Gel Pad,218000.0,0.0,0.0,0,"2022-01-24 08:37:25.145 +00:00"
2265220269,10322743,Win Mouse Pad Dengan Bantalan Gel Pergelangan Tangan Untuk Gaming / Ka,103678.0,0.0,0.0,0,"2022-01-24 08:37:23.654 +00:00"
2265280048,4696599,Pulpen Gel Warna Pink Bahan Metal Untuk Tanda Tangan / Hadiah Z2I9,64126.0,0.0,0.0,0,"2022-01-24 08:37:21.728 +00:00"
2265377032,10322743,Bantalan Pergelangan Tangan Bahan Silikon Gel Untuk Mouse Pad,122799.0,0.0,0.0,0,"2022-01-24 08:37:22.560 +00:00"
2265525911,10322743,"1pc Pulpen Gel Metal Kreatif 3 Warna Untuk Tanda Tangan U2T7",50181.0,0.0,0.0,0,"2022-01-24 08:37:21.466 +00:00"
2265569165,4696599,"5pcs Gel Pelindung Jari Tangan Untuk Perawatan Kulit",61533.0,0.0,0.0,0,"2022-01-24 08:37:20.976 +00:00"
2265623828,2606399,Mouse Pad Dengan Bantalan Pergelangan Tangan Bahan Silikon Gel Lembut,232897.0,0.0,0.0,0,"2022-01-24 08:37:21.301 +00:00"
2265641319,4696599,Fly - Cover Rem Tangan Bahan Silikon Gel Anti Slip Untuk Mobil Univers,60893.0,0.0,0.0,0,"2022-01-24 08:37:21.728 +00:00"
2265711420,89263,up Bsid Mouse Pad Dengan Bantalan Pergelangan Tangan Bahan Gel Silikon,241227.0,0.0,0.0,0,"2022-01-24 08:37:23.082 +00:00"
2265787033,4696599,Fsmy 1 Pasang Sarung Tangan Gel Silikon Pelindung Rem Sepeda,72024.0,0.0,0.0,0,"2022-01-24 08:37:20.976 +00:00"
2266120510,4696599,Ogiaoholiy Bantalan Gel Silikon Penyangga Pergelangan Tangan Untuk Mou,160328.0,0.0,0.0,0,"2022-01-24 08:37:20.976 +00:00"
2266253984,9085891,GLOVE PEARL IZUMI GEL SARUNG TANGAN SEPEDA HALF FINGER PEARLIZUMI,125000.0,0.0,0.0,0,"2022-01-24 08:37:25.376 +00:00"
2266791043,1384308,H.S.V Mouse Pad Gaming Ergonomis Dengan Gel Pergelangan Tangan Untuk K,101969.0,0.0,0.0,0,"2022-01-24 08:37:22.915 +00:00"
2266892857,10322743,Mouse Pad Dengan Bantalan Gel Pergelangan Tangan Desain Ergonomis Warn,103954.0,0.0,0.0,0,"2022-01-24 08:37:22.327 +00:00"
2267006182,1384308,Run Mouse Pad Dengan Bantalan Gel Pergelangan Tangan Desain Ergonomis,111066.0,0.0,0.0,0,"2022-01-24 08:37:22.069 +00:00"
2267039167,10391500,Sa 1pc Bantalan Gel Silikon Penyangga Pergelangan Tangan Untuk Mouse P,79700.0,0.0,0.0,0,"2022-01-24 08:37:24.803 +00:00"
2267221547,10391500,Tape Kertas Uv Gel Transparan Seamless Untuk Kerajinan Tangan Diy,83800.0,0.0,0.0,0,"2022-01-24 08:37:21.131 +00:00"
2267537878,11548940,LN815 ready Sarung Tangan Sepeda Rockbros - RB S106 Gel Pad Half Finge,132000.0,0.0,0.0,0,"2022-01-24 08:37:25.562 +00:00"
2267736782,10391500,HhfengWanita Korea ini kreatif pena gel akun tangan lucu pena warna un,108700.0,0.0,0.0,0,"2022-01-24 08:37:21.131 +00:00"
2267914878,6678211,Dispenser Tangan Dispenser Cair Tangan Anak-anak Dewasa Gel,61200.0,0.0,0.0,0,"2022-01-24 08:37:21.466 +00:00"
2268231746,5346636,Biore Guard Sabun Cuci Tangan Eucalyptus Gel Pouch 200 ml,74250.0,0.0,0.0,0,"2022-01-24 08:37:24.967 +00:00"
2268257475,9005985,lilsaint.id SARUNG TANGAN SEPEDA GIRO MONACO II GEL - WHITE M,705000.0,0.0,0.0,0,"2022-01-24 08:37:25.713 +00:00"
2268343979,10082853,TPD Sarung tangan Mavic Ksyrium BlackWhite Gel size M L dan XL,232000.0,0.0,0.0,0,"2022-01-24 08:37:24.967 +00:00"
2268586547,10391500,NuuPasangan Pelangi Tali Tangan Mahasiswa Wanita Korea Pacar Daisy Gel,184200.0,0.0,0.0,0,"2022-01-24 08:37:24.803 +00:00"
2269410339,5487542,Erid Mouse Pad Dengan Bantalan Pergelangan Tangan Bahan Gel Silikon Le,237650.0,0.0,0.0,0,"2022-01-24 08:37:22.069 +00:00"
2269605096,5487542,(Remitglory) Gantungan Kunci Gel Pembersih Tangan Aksen Rumbai Untuk A,121279.0,0.0,0.0,0,"2022-01-24 08:37:24.967 +00:00"
2269606534,12152870,ACL Pembersih Cleanser Gel Perfume BPOM 500ml Tangan untuk Barbershop,151000.0,0.0,0.0,0,"2022-01-24 08:37:24.492 +00:00"
2269912092,9720330,(Newnorthcast) Bantalan Gel Penyangga Pergelangan Tangan Warna,173200.0,0.0,0.0,0,"2022-01-24 08:37:25.926 +00:00"
2270547486,2772106,Pulpen Gel Mini Bentuk Kartun Kreatif Untuk Tanda Tangan,62300.0,0.0,0.0,0,"2022-01-24 08:37:25.926 +00:00"
2270748099,3673057,biore guard gel hand soap eucalyptus 200ml sabun cuci tangan refill,10800.0,0.0,0.0,1,"2022-01-24 08:37:21.728 +00:00"
2270927056,10391500,Mitsubishi Uniball Pen Gel Tanda Tangan Superfine 0.38 8 Warna Gelap,291200.0,0.0,0.0,0,"2022-01-24 08:37:21.131 +00:00"
2271403999,812334,BjCria Nicce Gel Perekat Perbaikan Perhiasan Buatan Tangan Cepat Ke,87500.0,0.0,0.0,0,"2022-01-24 08:37:24.140 +00:00"
2271527600,812334,BjCria Obrall 4Pcs Dispenser Gel Disinfektan Pembersih Tangan Warna,129330.0,0.0,0.0,0,"2022-01-24 08:37:22.728 +00:00"
2272035118,7040546,SARUNG TANGAN FOX RANGER GEL GLOVE,610000.0,0.0,0.0,0,"2022-01-24 08:37:25.145 +00:00"
2272047227,7040546,SARUNG TANGAN SEPEDA GLOVE GIRO GA BRAVO GEL MEN GLOVES,542000.0,0.0,0.0,0,"2022-01-24 08:37:24.967 +00:00"
2272246722,9005985,lilsaint.id SARUNG TANGAN SEPEDA GIRO BRAVO GEL,487000.0,0.0,0.0,0,"2022-01-24 08:37:25.145 +00:00"
2272259221,10391500,Tanabata Asli Handmade Jepang Tali Tangan Jalinan Beruntung Kucing Gel,524600.0,0.0,0.0,0,"2022-01-24 08:37:25.562 +00:00"
2272295369,11534959,ORI SEPEDA FINGER GEL GLOVES BIKE PAD S143 TANGAN HALF ROCKBROS SARUNG,283800.0,0.0,0.0,0,"2022-01-24 08:37:25.562 +00:00"
2273899427,11042466,Strap Pergelangan Tangan Bahan Gel Silikon Sekali Pakai Portable Multi,63900.0,0.0,0.0,0,"2022-01-24 08:37:25.713 +00:00"
2274692460,11042466,sichuan Bantalan Pergelangan Tangan Dan Mouse Bahan Gel Silika untuk L,97500.0,0.0,0.0,0,"2022-01-24 08:37:24.967 +00:00"
2274788512,11042466,yuantenggm1 Mouse Pad dengan Bantalan Gel Pergelangan Tangan untuk PC,69500.0,0.0,0.0,0,"2022-01-24 08:37:23.654 +00:00"
2274806740,11042466,Mouse Pad dengan Bantalan Gel Pergelangan Tangan untuk PC Laptop,80100.0,0.0,0.0,0,"2022-01-24 08:37:25.145 +00:00"
2274922940,11042466,sun44 Bantalan Pergelangan Tangan Bahan Gel Silikon untuk Mouse Pad Ko,88200.0,0.0,0.0,0,"2022-01-24 08:37:24.803 +00:00"
2274979892,11042466,yushenghuagong Mouse Pad dengan Bantalan Gel Pergelangan Tangan untuk,91500.0,0.0,0.0,0,"2022-01-24 08:37:25.926 +00:00"
2275912243,5005335,Rockbros Sarung Tangan Gel S169 Double Shockproof,202000.0,0.0,0.0,0,"2022-01-24 08:37:25.926 +00:00"
2275987532,5487542,Gel Perekat Perbaikan Perhiasan Buatan Tangan Cepat Kering Ukuran 9ml,113309.0,0.0,0.0,0,"2022-01-24 08:37:21.466 +00:00"
2276016780,5005335,KG3 Sarung Tangan Sepeda Gel Giyo 5 Warna,156000.0,0.0,0.0,0,"2022-01-24 08:37:25.145 +00:00"
2276111902,884447,TANLE Baru Kamuflase keel gel tangan Grip non-slip sweatband Kentalkan,66020.0,0.0,0.0,0,"2022-01-24 08:37:24.967 +00:00"
2276164843,884447,[TANLE]Baru dua warna keel gel tangan anti slip gel tangan raket,69790.0,0.0,0.0,0,"2022-01-24 08:37:24.492 +00:00"
2276209142,884447,Z-SPORT/Baru Kamuflase keel gel tangan Grip non-slip sweatband,62010.0,0.0,0.0,0,"2022-01-24 08:37:25.145 +00:00"
2276224118,884447,"10M gel tangan penyegelan lem aksesoris raket raket bulutangkis",71380.0,0.0,0.0,0,"2022-01-24 08:37:25.145 +00:00"
2276292169,10391500,Ornamen Gantungan Kunci Buatan Tangan Bahan Silika Gel Epoxy Resin Mot,107800.0,0.0,0.0,0,"2022-01-24 08:37:21.131 +00:00"
2276682697,6888570,Baru Manekin Tangan Bahan Plastik Untuk Display Perhiasan Cincin / Gel,253288.0,0.0,0.0,0,"2022-01-24 08:37:25.376 +00:00"
2278021102,9289595,NEW Giro Gloves Strade Dure Gel Black Medium sarung tangan giro .,500000.0,0.0,0.0,0,"2022-01-24 08:37:23.245 +00:00"
2278026634,9289595,NEW Giro Gloves Bravo Gel Medium Charcoal sarung tangan . kode 30964,500000.0,0.0,0.0,0,"2022-01-24 08:37:24.326 +00:00"
2278246054,884447,(Remitglory) Gantungan Kunci Gel Pembersih Tangan Aksen Rumbai Untuk,104660.0,0.0,0.0,0,"2022-01-24 08:37:25.926 +00:00"
2278699608,9753772,Sarung tangan sepeda Giro Monaco II Gel - ukuran size S-XL Altona,742000.0,0.0,0.0,0,"2022-01-24 08:37:24.492 +00:00"
2278699798,9753772,Sarung tangan sepeda Bontrager RXL Gel glove - ukuran M Altona garage,634000.0,0.0,0.0,0,"2022-01-24 08:37:24.492 +00:00"
2278700417,9753772,Sarung tangan sepeda Bontrager Solstice Gel Glove - size M-XL Altona,378000.0,0.0,0.0,0,"2022-01-24 08:37:24.803 +00:00"
2279248599,816721,Lontime Pulpen Gel 0.5mm Dengan Hiasan Kristal Untuk Tanda Tangan,50867.0,0.0,0.0,0,"2022-01-24 08:37:22.560 +00:00"
2280230892,11548940,DZ046 joss GUB 2098 Half Finger Lycra Gel Gloves GREY - Sarung Tangan,353000.0,0.0,0.0,0,"2022-01-24 08:37:24.967 +00:00"
2280260524,11042466,H02 Mouse Pad Ergonomik Dengan Gel Pergelangan Tangan,95400.0,0.0,0.0,0,"2022-01-24 08:37:23.082 +00:00"
2280404529,2830834,"1Pc Mini Musim Dingin Reusable Gel Tangan Hangat",88100.0,0.0,0.0,0,"2022-01-24 08:37:25.145 +00:00"
2280548863,2830834,Pegangan Tangan Gel Karet Aluminium untuk Motor,194800.0,0.0,0.0,0,"2022-01-24 08:37:25.562 +00:00"
2280603554,2830834,Bersepeda Sepeda Sepeda Motor Sport Gel Setengah Sarung Tangan,166500.0,0.0,0.0,0,"2022-01-24 08:37:23.082 +00:00"
2280968795,7621015,Sarung Tangan Sepeda Gel Half Finger Outdoor Glove Anti-Slip,49000.0,0.0,0.0,5,"2022-01-24 08:37:19.873 +00:00"
2281279992,5566475,KOMPRES GEL PENGHANGAT TANGAN MINI WINTER REUSABLE GEL HAND WARMER,15000.0,0.0,0.0,2,"2022-01-24 08:37:19.873 +00:00"
2281301880,884447,Mouse Pad Dengan Bantalan Pergelangan Tangan Bahan Gel Silikon Anti,91930.0,0.0,0.0,0,"2022-01-24 08:37:25.926 +00:00"
2281322525,884447,H.S.V Mouse Pad Gaming Ergonomis Dengan Gel Pergelangan Tangan Untuk,96000.0,0.0,0.0,0,"2022-01-24 08:37:25.562 +00:00"
2281629016,6308138,Lontime Pulpen Gel 0.5mm Dengan Hiasan Kristal Untuk Tanda Tangan,50867.0,0.0,0.0,0,"2022-01-24 08:37:22.560 +00:00"
2281675974,9289595,NEW Giro Gloves Monaco II Gel Small Bright Red sarung tangan . kode,765000.0,0.0,0.0,0,"2022-01-24 08:37:24.967 +00:00"
2281676297,9289595,NEW Giro Gloves Monaco II Gel Large Bright Red sarung tangan giro .,765000.0,0.0,0.0,0,"2022-01-24 08:37:22.728 +00:00"
2282149746,9899068,Moven Sarung Tangan Sepeda Gel Empuk Pearl Izumi - Gloves Pearl Izumi,90000.0,0.0,0.0,0,"2022-01-24 08:37:25.562 +00:00"
2282467683,7740770,Ran 4pcs Pulpen Gel 0.5mm Dengan Hiasan Kartun Buah Untuk Tanda Tangan,72579.0,0.0,0.0,0,"2022-01-24 08:37:21.466 +00:00"
2282725038,10082853,TPD sarung tangan sepeda laki laki men ultimate gel premium Cycling,279000.0,0.0,0.0,0,"2022-01-24 08:37:25.562 +00:00"
2282912379,7040019,H.S.V Mouse Pad Gaming Ergonomis Dengan Gel Pergelangan Tangan Untuk K,101969.0,0.0,0.0,0,"2022-01-24 08:37:23.245 +00:00"
2282964052,884447,Bang Mouse Pad Dengan Bantalan Gel Pergelangan Tangan Ergonomis Untuk,99250.0,0.0,0.0,0,"2022-01-24 08:37:23.654 +00:00"
2283096623,7740770,Jinfucha Pulpen Gel Warna Laser Mermaid Untuk Tanda Tangan,51218.0,0.0,0.0,0,"2022-01-24 08:37:21.466 +00:00"
2283163707,7740770,Pursun Gantungan Kunci Holder Gel Pembersih Tangan Aksen Rumbai Untuk,74575.0,0.0,0.0,0,"2022-01-24 08:37:20.456 +00:00"
2283503881,884447,Mouse Pad Dengan Bantalan Gel Pergelangan Tangan Bahan Karet Anti Slip,120510.0,0.0,0.0,0,"2022-01-24 08:37:23.654 +00:00"
2283703875,2830834,Bantalan Sandaran Tangan Keren Bahan Silikon Keyboard Gel Meja,338500.0,0.0,0.0,0,"2022-01-24 08:37:25.145 +00:00"
2283971953,7740770,Gel Perekat Perbaikan Perhiasan Buatan Tangan Cepat Kering Ukuran 9ml,113309.0,0.0,0.0,0,"2022-01-24 08:37:22.069 +00:00"
2284184797,7740770,Fly - Cover Rem Tangan Bahan Silikon Gel Anti Slip Untuk Mobil Univers,60893.0,0.0,0.0,0,"2022-01-24 08:37:20.456 +00:00"
2284224168,7740770,Pulpen Gel Hitam 0.5mm Model Kartun Binatang Lucu Untuk Tanda Tangan/S,32413.0,0.0,0.0,0,"2022-01-24 08:37:21.466 +00:00"
2284382223,9085891,BONTRAGER CIRCUIT TWIN GEL GLOVE GANT - SARUNG TANGAN,415000.0,0.0,0.0,0,"2022-01-24 08:37:25.145 +00:00"
2284382275,9085891,BONTRAGER SOLSTICE GEL CYCLING GLOVE - SARUNG TANGAN,385000.0,0.0,0.0,0,"2022-01-24 08:37:24.140 +00:00"
2284729838,10391500,Buatan Tangan Tong Meng Club SOTA SOTA Kapsul Gel Silikon D,1019800.0,0.0,0.0,0,"2022-01-24 08:37:21.131 +00:00"
2284887918,2102052,Antis Hand Sanitizer Botol Gel Jeruk Nipis 60ml Pembersih Tangan,8500.0,0.0,0.0,0,"2022-01-24 08:37:21.466 +00:00"
2285153545,789161,Gel Perekat Perbaikan Perhiasan Buatan Tangan Cepat Kering Ukuran 9ml,113309.0,0.0,0.0,0,"2022-01-24 08:37:25.376 +00:00"
2285285853,789161,Lontime Pulpen Gel 0.5mm Dengan Hiasan Kristal Untuk Tanda Tangan,50867.0,0.0,0.0,0,"2022-01-24 08:37:22.069 +00:00"
2285554704,11042466,"50 100 200pcs 1g Silica Gel Non Toxic Untuk Kerajinan Tangan",61800.0,0.0,0.0,0,"2022-01-24 08:37:25.145 +00:00"
2285939143,10391500,Sarung Tangan Gel Setengah Jari Untuk Olahraga Sepeda Motor,57400.0,0.0,0.0,0,"2022-01-24 08:37:20.456 +00:00"
2285939879,10391500,saku Sarung Tangan Gel Setengah Jari Untuk Bersepeda Olahraga Outdoor,56200.0,0.0,0.0,0,"2022-01-24 08:37:21.131 +00:00"
2285989157,10391500,Sarung Tangan Pria Wanita Bahan Gel Ultra Ringan Anti Slip untuk Seped,73500.0,0.0,0.0,0,"2022-01-24 08:37:21.131 +00:00"
2286040587,10391500,Ocean Sarung Tangan Setengah Jari Bahan Gel Kualitas Tinggi untuk Sepe,86900.0,0.0,0.0,0,"2022-01-24 08:37:25.562 +00:00"
2286241476,11042466,Gel Pembersih Tangan Alkohol Tanpa Air Anti Bakteri Melembabkan Portab,80700.0,0.0,0.0,0,"2022-01-24 08:37:24.140 +00:00"
2286259938,11042466,Hl Gel Pembersih Tangan Portable Anti Bakteri Tanpa Air Untuk Travel o,81600.0,0.0,0.0,0,"2022-01-24 08:37:25.926 +00:00"
2286734651,9676121,Koi Pen Gel Tinta Hitam 0.5mm Retractable Untuk Tanda Tangan / Pelajar,54600.0,0.0,0.0,0,"2022-01-24 08:37:22.728 +00:00"
2287893202,2057042,ORIGINAL SARUNG TANGAN SHIMANO HALF PRO GEL PADDING GLOVES BIRU,57900.0,0.0,0.0,0,"2022-01-24 08:37:20.456 +00:00"
2288036519,9204981,Dispenser Gel Tangan Otomatis NonKontak 2200ml Dapat DSALE,738000.0,0.0,0.0,0,"2022-01-24 08:37:21.466 +00:00"
2288076364,1013930,Rockbros Sarung Tangan Sepeda Half Finger Shock Gel Absorber S169,194500.0,0.0,0.0,0,"2022-01-24 08:37:23.245 +00:00"
2288150088,754179,Sarung Tangan❥ Holder Botol Kosong Bahan Silikon Gel Anti Bakteri Be,54179.0,0.0,0.0,0,"2022-01-24 08:37:22.728 +00:00"
2288390886,754179,Bsid Mouse Pad Dengan Bantalan Pergelangan Tangan Bahan Gel Silikon Mo,241227.0,0.0,0.0,0,"2022-01-24 08:37:23.245 +00:00"
2288757748,6974112,H.S.V Mouse Pad Gaming Ergonomis Dengan Gel Pergelangan Tangan Untuk,104400.0,0.0,0.0,0,"2022-01-24 08:37:21.728 +00:00"
2288774549,6974112,Peacesujn 1pc Botol Gel Penghangat Tangan Mini Transparan Reusable,91300.0,0.0,0.0,0,"2022-01-24 08:37:21.728 +00:00"
2288800316,789161,(Peacesujn) 1pc Botol Gel Penghangat Tangan Mini Transparan Reusable U,84461.0,0.0,0.0,0,"2022-01-24 08:37:24.967 +00:00"
2288839649,6974112,Bantalan Gel Silikon Penyangga Pergelangan Tangan Motif Telapak Kaki,464700.0,0.0,0.0,0,"2022-01-24 08:37:22.915 +00:00"
2288874469,6705481,-; Bantalan Pergelangan Tangan Bahan Silikon Gel Untuk Mouse Pad,126474.0,0.0,0.0,0,"2022-01-24 08:37:24.492 +00:00"
2288881616,6705481,x Bantalan Pergelangan Tangan Bahan Silikon Gel Untuk Mouse Pad,121474.0,0.0,0.0,0,"2022-01-24 08:37:24.326 +00:00"
2289135796,754179,H.S.V Mouse Pad Gaming Ergonomis Dengan Gel Pergelangan Tangan Untuk K,101969.0,0.0,0.0,0,"2022-01-24 08:37:22.069 +00:00"
2289164722,9204981,Mouse Pad Dengan Bantalan Pergelangan Tangan Bahan Gel TERMURAH,112000.0,0.0,0.0,0,"2022-01-24 08:37:23.829 +00:00"
2289625932,884447,Mouse Pad Dengan Bantalan Gel Pergelangan Tangan Desain Ergonomis,119860.0,0.0,0.0,0,"2022-01-24 08:37:23.245 +00:00"
2289773191,10001538,Mojito Bantalan Gel Nyaman Penyangga Pergelangan Tangan Keyboard Pc,160000.0,0.0,0.0,0,"2022-01-24 08:37:24.140 +00:00"
2289774105,10001538,Rr Bantalan Gel Nyaman Penyangga Pergelangan Tangan Keyboard Pc,169000.0,0.0,0.0,0,"2022-01-24 08:37:24.140 +00:00"
2289995085,10001538,Bantalan Gel Nyaman Penyangga Pergelangan Tangan Keyboard Pc,171000.0,0.0,0.0,0,"2022-01-24 08:37:24.492 +00:00"
2291164929,10391500,"75 Gel Tangan Disinfektan Portable Cepat Kering 75 Untuk Anak",222700.0,0.0,0.0,0,"2022-01-24 08:37:21.131 +00:00"
2291182777,5473068,Mouse Pad Ergonomis Dengan Bantalan Gel Pergelangan Tangan Untuk Pc/la,60093.0,0.0,0.0,0,"2022-01-24 08:37:22.560 +00:00"
2291458701,9676121,Inn Mouse Pad Ergonomik Dengan Bantalan Gel Pergelangan Tangan,132500.0,0.0,0.0,0,"2022-01-24 08:37:22.728 +00:00"
2291582816,87842,XIJING 5 buah 0.5mm Pena Gel Tinta Hitam | Alat Tulis Tanda Tangan Kan,63710.0,0.0,0.0,0,"2022-01-24 08:37:24.326 +00:00"
2291729932,6712898,"2pcs Sabun Gel Cair Pembersih Tangan Portabel Ukuran",150900.0,0.0,0.0,0,"2022-01-24 08:37:23.245 +00:00"
2292052119,87842,H.S.V Mouse Pad Gaming Ergonomis Dengan Gel Pergelangan Tangan Untuk K,101969.0,0.0,0.0,0,"2022-01-24 08:37:20.456 +00:00"
2292074544,4822296,Gratis Ongkir - Sarung tangan Mavic Ksyrium Gel size M dan L Flo Green,325000.0,0.0,0.0,0,"2022-01-24 08:37:24.140 +00:00"
2292136943,87842,"10pcs / Lot Pulpen Gel 0.38mm Lucu Untuk Menulis / Tanda Tangan / Seko",90629.0,0.0,0.0,0,"2022-01-24 08:37:24.326 +00:00"
2292140929,5473068,(Wyl) Mouse Pad Dengan Bantalan Pergelangan Tangan Bahan Gel Silikon M,225901.0,0.0,0.0,0,"2022-01-24 08:37:23.245 +00:00"
2292310655,693978,"1pc Pulpen Gel Metal Kreatif 3 Warna Untuk Tanda Tangan U2T7",50181.0,0.0,0.0,0,"2022-01-24 08:37:22.069 +00:00"
2292321344,754179,"1pc Pulpen Gel Metal Kreatif 3 Warna Untuk Tanda Tangan U2T7",50181.0,0.0,0.0,0,"2022-01-24 08:37:23.245 +00:00"
2292388245,87842,Ran 4pcs Pulpen Gel 0.5mm Dengan Hiasan Kartun Buah Untuk Tanda Tangan,72579.0,0.0,0.0,0,"2022-01-24 08:37:24.803 +00:00"
2292481399,87842,Bantalan Pergelangan Tangan Bahan Silikon Gel Lembut Motif Cakar Kucin,247669.0,0.0,0.0,0,"2022-01-24 08:37:24.967 +00:00"
2292751808,5473068,"6 Buah/Set Kartun Press Gel Pulpen Mahasiswa Ujian Tanda Tangan Hitam",80166.0,0.0,0.0,0,"2022-01-24 08:37:24.967 +00:00"
2292913735,5473068,"5 Buah Gel Pena Warna Tangan Akun Macaron Warna Perlengkapan Sekolah",70000.0,0.0,0.0,0,"2022-01-24 08:37:24.492 +00:00"
2294206088,87842,(Wyl) Mouse Pad Dengan Bantalan Pergelangan Tangan Bahan Gel Silikon M,225901.0,0.0,0.0,0,"2022-01-24 08:37:23.245 +00:00"
2294857037,2830834,Sarung Tangan Bersepeda Uniseks Sarung Tangan Gel,200500.0,0.0,0.0,0,"2022-01-24 08:37:24.967 +00:00"
2294901642,215830,Ran 4pcs Pulpen Gel 0.5mm Dengan Hiasan Kartun Buah Untuk Tanda Tangan,72579.0,0.0,0.0,0,"2022-01-24 08:37:24.492 +00:00"
2295136007,2830834,Nyaman Sepeda Motor Sepeda Bersepeda Sport Gel Setengah Sarung Tangan,160600.0,0.0,0.0,0,"2022-01-24 08:37:23.082 +00:00"
2295136627,2830834,Outdoor Gel Sepeda Setengah Jari Sarung Tangan Sepeda Pendek Sarung,179400.0,0.0,0.0,0,"2022-01-24 08:37:24.967 +00:00"
2295159524,2830834,"1 Buah Gel Silika Pegangan Tangan Portabel Cincin Genggaman",107200.0,0.0,0.0,0,"2022-01-24 08:37:25.713 +00:00"
2295231138,215830,(Peacesujn) 1pc Botol Gel Penghangat Tangan Mini Transparan Reusable U,74461.0,0.0,0.0,0,"2022-01-24 08:37:25.713 +00:00"
2295273109,215830,Goo Pulpen Gel Bentuk Segitiga Bahan Metal Untuk Tanda Tangan / Bisnis,80461.0,0.0,0.0,0,"2022-01-24 08:37:23.082 +00:00"
2295274783,215830,Goo 4pcs Pulpen Gel Netral Bentuk Kucing Untuk Tanda Tangan / Sekolah,71093.0,0.0,0.0,0,"2022-01-24 08:37:24.140 +00:00"
2296344192,1110193,Cetakan Kristal Epoksi Lem Buatan Tangan Diy Bahan Silika Gel,87600.0,0.0,0.0,0,"2022-01-24 08:37:25.926 +00:00"
2296623874,1110193,Model Tangan Bahan Plastik Akrilik Gel Untuk Latihan Nail,181900.0,0.0,0.0,0,"2022-01-24 08:37:25.926 +00:00"
2296868487,9195435,Sarung Tangan Sepeda Gel Touch Screen Full Finger GIYO S05L,205000.0,0.0,0.0,0,"2022-01-24 08:37:24.967 +00:00"
2296872383,10780742,Sarung Tangan Sepeda Gel Touch Screen Full Finger GIYO S05L,228000.0,0.0,0.0,0,"2022-01-24 08:37:23.245 +00:00"
2297076802,9195435,Sarung tangan sepeda GEL,205000.0,0.0,0.0,0,"2022-01-24 08:37:25.376 +00:00"
2297086437,9195435,Sarung Tangan Sepeda Gel ROCKBROS S143 Double Shockproof,165000.0,0.0,0.0,0,"2022-01-24 08:37:24.967 +00:00"
2297087181,10780742,Sarung Tangan Sepeda Gel ROCKBROS S143 Double Shockproof,176000.0,0.0,0.0,0,"2022-01-24 08:37:24.803 +00:00"
2297242889,10780742,Sarung Tangan Sepeda Gel Full Finger GIYO S02L,169000.0,0.0,0.0,0,"2022-01-24 08:37:22.560 +00:00"
2297317030,10780742,Sarung Tangan Sepeda Gel ROCKBROS S169 Double Shockproof,215000.0,0.0,0.0,0,"2022-01-24 08:37:23.245 +00:00"
2297862683,8845041,imoda 1 pc Hitam Tanda Tangan Gel Pena Menggambar Kerajinan Pena Alat,39698.0,0.0,0.0,0,"2022-01-24 08:37:23.829 +00:00"
2297943245,9843420,MB - SARUNG TANGAN SEPEDA GEL PAD - GLOVES SEPEDA PADDING GEL - SOFT,91000.0,0.0,0.0,0,"2022-01-24 08:37:25.562 +00:00"
2298243923,2830834,Gelang Pembersih Tangan Portabel Perjalanan Dispenser Gel Pembersih,99500.0,0.0,0.0,0,"2022-01-24 08:37:24.967 +00:00"
2298274241,215830,XIJING 5 buah 0.5mm Pena Gel Tinta Hitam | Alat Tulis Tanda Tangan Kan,63710.0,0.0,0.0,0,"2022-01-24 08:37:24.803 +00:00"
2298274353,215830,"5 Buah Gel Pena Warna Tangan Akun Macaron Warna Perlengkapan Sekolah",64552.0,0.0,0.0,0,"2022-01-24 08:37:25.145 +00:00"
2298359472,215830,Mouse Pad Dengan Bantalan Pergelangan Tangan Bahan Silikon Gel Lembut,232897.0,0.0,0.0,0,"2022-01-24 08:37:23.245 +00:00"
2298465591,7137733,Original Sarung Tangan Sepeda ROCKBROS S143 Half Finger Gel Pad Glove,187000.0,0.0,0.0,0,"2022-01-24 08:37:24.803 +00:00"
2298606521,7539519,Sarung Tangan Sepeda Gel Pearl Izumi Cycling Gloves MTB,33850.0,0.0,0.0,32,"2022-01-24 08:37:20.714 +00:00"
2298739482,328002,(Wyl) Mouse Pad Dengan Bantalan Pergelangan Tangan Bahan Gel Silikon M,225901.0,0.0,0.0,0,"2022-01-24 08:37:21.728 +00:00"
2299206030,328002,"6 Buah/Set Kartun Press Gel Pulpen Mahasiswa Ujian Tanda Tangan Hitam",80166.0,0.0,0.0,0,"2022-01-24 08:37:21.728 +00:00"
2299295836,328002,"5 buah 0.5mm Pena Gel Tinta Hitam | Alat Tulis Tanda Tangan Kantor Sis",63710.0,0.0,0.0,0,"2022-01-24 08:37:21.728 +00:00"
2300682301,11042466,Bantalan Gel Pergelangan Tangan Ergonomis Dengan Memory Foam Untuk Key,140200.0,0.0,0.0,0,"2022-01-24 08:37:25.926 +00:00"
2300772432,11042466,Bantalan Gel Pergelangan Tangan Ergonomis dengan Memory Foam untuk PC,140200.0,0.0,0.0,0,"2022-01-24 08:37:25.926 +00:00"
2301356567,9819947,ROCKBROS S143 Sarung Tangan Sepeda - Bike Glove Half Finger Gel Pad -,173000.0,0.0,0.0,0,"2022-01-24 08:37:22.728 +00:00"
2303221952,8723903,AZSTAR Gloves DH Sport Sarung Tangan Sepeda dengan Gel dan Reflektif,160000.0,0.0,0.0,0,"2022-01-24 08:37:22.560 +00:00"
2303480425,89263,new Luckyx Bantalan Gel Nyaman Penyangga Pergelangan Tangan Untuk Keyb,123569.0,0.0,0.0,0,"2022-01-24 08:37:24.140 +00:00"
2306536053,8845041,Mouse Pad Dengan Bantalan Gel Pergelangan Tangan Bahan Karet Anti Slip,97800.0,0.0,0.0,0,"2022-01-24 08:37:24.803 +00:00"
2306707843,8845041,Goo Pulpen Gel Bentuk Segitiga Bahan Metal Untuk Tanda Tangan / Bisnis,85461.0,0.0,0.0,0,"2022-01-24 08:37:23.654 +00:00"
2306708748,8845041,Goo 4pcs Pulpen Gel Netral Bentuk Kucing Untuk Tanda Tangan / Sekolah,76093.0,0.0,0.0,0,"2022-01-24 08:37:23.829 +00:00"
2306721362,323770,XIJING 5 buah 0.5mm Pena Gel Tinta Hitam | Alat Tulis Tanda Tangan Kan,63710.0,0.0,0.0,0,"2022-01-24 08:37:24.326 +00:00"
2307237182,323770,"10pcs / Lot Pulpen Gel 0.38mm Lucu Untuk Menulis / Tanda Tangan / Seko",90629.0,0.0,0.0,0,"2022-01-24 08:37:24.326 +00:00"
2307251575,11140231,erfolg - BONTRAGER Solstice Gel Cycling Glove Black - Sarung Tangan,358000.0,0.0,0.0,0,"2022-01-24 08:37:25.926 +00:00"
2307570457,323770,Ran 4pcs Pulpen Gel 0.5mm Dengan Hiasan Kartun Buah Untuk Tanda Tangan,72579.0,0.0,0.0,0,"2022-01-24 08:37:24.140 +00:00"
2307604233,6249750,Cussons Carex Hand Sanitizer Gel Antibacterial Pembersih Tangan 50 ml,10000.0,0.0,0.0,0,"2022-01-24 08:37:20.976 +00:00"
2307647214,11091061,CATHRINE - sarung tangan sepeda laki laki men ultimate gel premium,279000.0,0.0,0.0,0,"2022-01-24 08:37:21.466 +00:00"
2307656130,323770,Bantalan Pergelangan Tangan Bahan Silikon Gel Lembut Motif Cakar Kucin,247669.0,0.0,0.0,0,"2022-01-24 08:37:24.967 +00:00"
2307743301,8845041,Pulpen Gel Isi Ulang Ukuran 0.5mm Untuk Tanda Tangan,56351.0,0.0,0.0,0,"2022-01-24 08:37:22.560 +00:00"
2307873080,323770,(Peacesujn) 1pc Botol Gel Penghangat Tangan Mini Transparan Reusable U,74461.0,0.0,0.0,0,"2022-01-24 08:37:25.713 +00:00"
2308163366,6034722,Unik Mouse Wrist Pad Mousepad Gel Bantalan Pergelangan Tangan Diskon,107000.0,0.0,0.0,0,"2022-01-24 08:37:23.245 +00:00"
2309792161,5433670,(Baoblaze1) Bantal Sandaran Tangan / Siku Bahan Busa Gel Untuk Kursi,181882.0,0.0,0.0,0,"2022-01-24 08:37:23.245 +00:00"
2314061567,884447,Fbid Mouse Pad Dengan Bantalan Pergelangan Tangan Bahan Gel Silikon,203950.0,0.0,0.0,0,"2022-01-24 08:37:23.245 +00:00"
2315512608,5820736,Goldensquare11 1 Pasang Sarung Tangan Gel Silikon Cover Proteksi Rem,117100.0,0.0,0.0,0,"2022-01-24 08:37:22.728 +00:00"
2315981458,4822296,Gratis Ongkir - Sarung Tangan Glove Giro BRAVO Gel,555000.0,0.0,0.0,0,"2022-01-24 08:37:25.562 +00:00"
2316132927,4822296,Gratis Ongkir - Sarung Tangan Gloves GiIRO Stradedure Super Gel,500000.0,0.0,0.0,0,"2022-01-24 08:37:23.654 +00:00"
2316133655,4822296,Gratis Ongkir - SARUNG TANGAN FOX RANGER GEL GLOVE,620000.0,0.0,0.0,0,"2022-01-24 08:37:25.376 +00:00"
2317269281,8619785,Mouse Pad Dengan Bantalan Gel Pergelangan Tangan Bahan Karet Anti,108600.0,0.0,0.0,0,"2022-01-24 08:37:24.967 +00:00"
2319540309,5820736,Lucu Kartun Gitar Bentuk Gel Pena Alat Musik Air Hitam Tanda Tangan,81300.0,0.0,0.0,0,"2022-01-24 08:37:22.327 +00:00"
