"skuId","shopId","productName","discountedPrice","originalPrice","rating","soldCount","createdAt"
1583386614,1673118,Konicare Gel Pembersih Tangan 60ml Handsanitizer Hand Sanitizer,8850.0,0.0,0.0,4,"2022-01-24 08:37:19.873 +00:00"
1586685413,9812873,GLOVE SEPEDA GIRO BRAVO GEL SARUNG TANGAN,410000.0,0.0,0.0,5,"2022-01-24 08:37:19.589 +00:00"
1586699710,9812873,GLOVE SEPEDA GIRO STRADE DURE SUPER GEL SARUNG TANGAN,370000.0,0.0,0.0,2,"2022-01-24 08:37:20.200 +00:00"
1591042133,9669058,SARUNG TANGAN SEPEDA GIANT GEL NEW,229000.0,0.0,0.0,0,"2022-01-24 08:37:24.803 +00:00"
1591783781,8431914,PULPEN PEN GEL TANDA TANGAN TAHAN AIR UM-153 UNIBALL 1.0 MM WATERPROOF,30000.0,0.0,0.0,3,"2022-01-24 08:37:19.588 +00:00"
1594147710,6788315,Sarung Tangan Sepeda Gel Half Finger Rockbros Size L / XL - S143,156000.0,0.0,0.0,2,"2022-01-24 08:37:20.200 +00:00"
1594205637,6788315,Sarung Tangan / Riding Gloves Sepeda Motor Gel Full Finger Coolchange,175000.0,0.0,0.0,3,"2022-01-24 08:37:19.413 +00:00"
1596139138,422438,Giyo Gloves Sarung Tangan Premium Gel Sepeda Lipat Road Bike MTB,129900.0,0.0,0.0,26,"2022-01-24 08:37:19.873 +00:00"
1597637849,7137733,Glove - Sarung Tangan Shimano Gel Blue,92000.0,0.0,0.0,0,"2022-01-24 08:37:24.140 +00:00"
1597833238,8334204,CoolChange Sarung Tangan Sepeda Silicone Gel Pad - Size XXL,196500.0,0.0,0.0,2,"2022-01-24 08:37:19.589 +00:00"
1598050643,10548003,Sarung Tangan Gel Setengah Jari Ukuran XL 3 Warna untuk Sepeda /,126120.0,0.0,0.0,0,"2022-01-24 08:37:22.728 +00:00"
1603461340,1227911,Sarung Tangan Sepeda Gloves Sepeda Pearl Izumi Gel Murah,49500.0,0.0,0.0,15,"2022-01-24 08:37:20.200 +00:00"
1603493270,2907916,Sarung Tangan Setengah Jari Bahan Gel untuk Bersepeda,181300.0,0.0,0.0,0,"2022-01-24 08:37:25.145 +00:00"
1603509688,2907916,Sarung Tangan Gel Setengah Jari 3 Warna Ukuran S-Xl Untuk,139000.0,0.0,0.0,0,"2022-01-24 08:37:25.145 +00:00"
1604187233,2907916,Masker Tangan Gel Nitizer 70ml Ukuran Saku Portable Cepat Kering,121400.0,0.0,0.0,0,"2022-01-24 08:37:22.915 +00:00"
1604634087,2907916,"729 Cover Pelindung Tuas Rem Tangan Universal Bahan Gel Silikon",85500.0,0.0,0.0,0,"2022-01-24 08:37:23.245 +00:00"
1606166933,3007257,Sarung tangan sepeda Sarung Tangan gel setengah bersepeda/Motor,109300.0,0.0,0.0,0,"2022-01-24 08:37:25.145 +00:00"
1606449466,168294,antiseptik pembersih tangan onemed gel 500ml,45000.0,0.0,0.0,0,"2022-01-24 08:37:20.714 +00:00"
1606974308,6164959,Sarung Tangan Sepeda Gel Pearl Isumi Bike/Cycling gloves MTB,32000.0,0.0,0.0,729,"2022-01-24 08:37:19.413 +00:00"
1607137349,3007257,Sarung Tangan Setengah Jari Non Slip Bahan Silika Gel Untuk Olahraga,111300.0,0.0,0.0,0,"2022-01-24 08:37:25.713 +00:00"
1608008666,4460427,Mouse Pad Dengan Bantalan Gel Pergelangan Tangan Ergonomis Warna,128300.0,0.0,0.0,0,"2022-01-24 08:37:23.654 +00:00"
1608658309,471271,Keyboard Wrist Pad Bantalan Tangan Memory Foam Mouse Pad Gel Square,23000.0,0.0,0.0,100,"2022-01-24 08:37:19.413 +00:00"
1612315758,163729,HOLLY HAND SANITIZER GEL KEMASAN LUCU 30ML / ANTISEPTIC TANGAN,9000.0,0.0,0.0,21,"2022-01-24 08:37:20.200 +00:00"
1612649823,4460427,Fitness Mountain Laki-laki Glove Sarung Tangan gel setengah,107400.0,0.0,0.0,0,"2022-01-24 08:37:23.654 +00:00"
1613637063,4460427,Mouse Pad Anti Slip dengan Gel Pergelangan Tangan untuk PC / Laptop,117800.0,0.0,0.0,0,"2022-01-24 08:37:22.560 +00:00"
1615648492,4460427,Dispenser Sabun Gel Shampoo Tangan Bahan Plastik Transparan,124200.0,0.0,0.0,0,"2022-01-24 08:37:24.326 +00:00"
1615649974,4460427,"5pcs Dispenser Sabun Mandi Gel Shampoo Tangan Bahan Plastik",228000.0,0.0,0.0,0,"2022-01-24 08:37:24.326 +00:00"
1617454452,10076967,Glove - Sarung Tangan Shimano Gel Red (Epidot Bike),168500.0,0.0,0.0,0,"2022-01-24 08:37:19.873 +00:00"
1617454513,10076967,Glove - Sarung Tangan Shimano Gel tokpedue (Epidot Bike),168500.0,0.0,0.0,0,"2022-01-24 08:37:23.654 +00:00"
1619833157,9570364,Giro Cycling Gloves Tessa Gel Icebergh Blue Sarung Tangan Sepeda RB,500000.0,0.0,0.0,1,"2022-01-24 08:37:20.200 +00:00"
1620451619,2994641,SARUNG TANGAN / GLOVES RACE SERIES GEL STRUMMER A.361,160000.0,0.0,0.0,1,"2022-01-24 08:37:20.200 +00:00"
1621488377,2271088,Aseptic Antiseptic Gel - Pencuci Tangan Tanpa Air,60000.0,0.0,0.0,2,"2022-01-24 08:37:20.200 +00:00"
1624026327,9712135,KL INA - Hand Sanitizer Gel Anti kuman Bakteri Perbersih Tangan NSP,51000.0,0.0,0.0,0,"2022-01-24 08:37:24.326 +00:00"
1626697765,7499906,Sel 12pcs/set Pulpen Gel 0.38mm Tinta Netral Untuk Tanda Tangan/Alat,129100.0,0.0,0.0,0,"2022-01-24 08:37:24.326 +00:00"
1626697769,7499906,"4pcs Pulpen Gel Ukuran 0.5mm Bentuk Kartun Buah Untuk Tanda Tangan",97100.0,0.0,0.0,0,"2022-01-24 08:37:24.803 +00:00"
1626749086,7499906,Tree 50ml Hand Sanitizer Gel Anti Bakteri Ukuran Tangan/Portable,120600.0,0.0,0.0,0,"2022-01-24 08:37:22.327 +00:00"
1629009450,10923835,"1pc Sarung Tangan Model Anti-Selip & Panas, Bahan Silica Gel",4000.0,0.0,0.0,2,"2022-01-24 08:37:20.200 +00:00"
1629938735,9753772,Gloves DH Sport Sarung Tangan Sepeda dengan Gel dan Reflektif Putih,162000.0,0.0,0.0,0,"2022-01-24 08:37:19.588 +00:00"
1630024996,9432555,Sarung Tangan Olahraga - Sarung Tangan Gym with Gel [M] [Biru],40495.0,0.0,0.0,3,"2022-01-24 08:37:19.588 +00:00"
1630644194,9237501,"Sarung tangan sepeda pearl izumi, sarung tangan gym, sarung tangan gel",30000.0,0.0,0.0,263,"2022-01-24 08:37:19.588 +00:00"
1632702696,9005985,Sarung Tangan Liteskin Half Finger Anti Slip Bahan Gel Road Bike MTB,324000.0,0.0,0.0,0,"2022-01-24 08:37:19.873 +00:00"
1634293606,200427,HALF FINGER GLOVES PEARL IZUMI GEL SARUNG TANGAN SEPEDA / GYM FITNES,39000.0,0.0,0.0,33,"2022-01-24 08:37:19.413 +00:00"
1637455333,9268663,Giyo Gloves Sarung Tangan Premium Gel Sepeda Lipat Road Bike MTB,118800.0,0.0,0.0,69,"2022-01-24 08:37:19.873 +00:00"
1639484906,4228432,SARUNG TANGAN GEL PEARL IZUMI BIRU SIZE M IVP,190000.0,0.0,0.0,0,"2022-01-24 08:37:25.713 +00:00"
1639803940,4606258,"30ml Gel Pelembab Tangan Portable Anti Bakteri Wangi Buah",98800.0,0.0,0.0,0,"2022-01-24 08:37:25.145 +00:00"
1640596961,4606258,Dispenser Gel Tangan Otomatis Tanpa Sentuh Kapasitas 1200ml Untuk,2183800.0,0.0,0.0,0,"2022-01-24 08:37:24.492 +00:00"
1640603911,4606258,Sarung Tangan Gel Setengah Jari Ukuran XL 3 Warna untuk Sepeda /,126900.0,0.0,0.0,0,"2022-01-24 08:37:24.492 +00:00"
1641046780,4606258,✿ Biking Sarung Tangan Gel Setengah Jari Untuk Bersepeda,158800.0,0.0,0.0,0,"2022-01-24 08:37:23.082 +00:00"
1641062754,4606258,Avail-Sarung Tangan Half Finger Dengan Gel Untuk Sepeda / Motor,95300.0,0.0,0.0,0,"2022-01-24 08:37:25.926 +00:00"
1643204774,8643191,Pul pen Tizo TG.340 - 1.0mm - Gel Liner - Bol pen Tanda tangan,42500.0,0.0,0.0,10,"2022-01-24 08:37:19.413 +00:00"
1643895457,4606258,Sarung Tangan Gel Model Setengah Jari 3 Warna Ukuran S-Xl Untuk,114400.0,0.0,0.0,0,"2022-01-24 08:37:24.140 +00:00"
1644118565,4606258,Sarung Tangan Teether Bahan Gel Silikon Lembut Untuk Bayi,111600.0,0.0,0.0,0,"2022-01-24 08:37:25.376 +00:00"
1646813351,10247151,"60ml Gel Pembersih Tangan Portabel Dengan Sarung Gantungan Kunci",108500.0,0.0,0.0,0,"2022-01-24 08:37:25.713 +00:00"
1647097297,10247151,Aksesoris Sepeda: Sarung Tangan Gel Setengah Jari Dengan Kait,140000.0,0.0,0.0,0,"2022-01-24 08:37:25.713 +00:00"
1647124379,10247151,Sarung Tangan Half Finger Dengan Gel Untuk Bersepeda,162700.0,0.0,0.0,0,"2022-01-24 08:37:25.713 +00:00"
1647340484,10247151,Sarung Tangan Gel Silikon Setengah Jari Untuk Bersepeda M-XL,212700.0,0.0,0.0,0,"2022-01-24 08:37:25.145 +00:00"
1647738607,10247151,"5pcs/set Model Jari Tangan Latihan Nail Art Akrilik Gel Salon",118900.0,0.0,0.0,0,"2022-01-24 08:37:25.145 +00:00"
1647811488,7499906,Gel Sanitizer Tangan Instan Efektif Sekali Pakai Ukuran 55ml Untuk,108200.0,0.0,0.0,0,"2022-01-24 08:37:24.967 +00:00"
1647929678,7499906,Sireck Sarung tangan bersepeda Gel empuk Bernapas Sarung Tangan,185800.0,0.0,0.0,0,"2022-01-24 08:37:24.967 +00:00"
1648836085,1430195,Quick N Fresh Hand Gel 100ml / Hand Sanitizer / Pembersih Tangan,9595.0,0.0,0.0,8,"2022-01-24 08:37:19.413 +00:00"
1648984561,7499906,Sarung Tangan Gel Setengah Jari Ukuran XL untuk Bersepeda / Olahraga,142900.0,0.0,0.0,0,"2022-01-24 08:37:23.654 +00:00"
1649496867,5155913,Sarung Tangan Multifungsi Bahan Silika Gel Anti Slip Warna Acak,59900.0,0.0,0.0,0,"2022-01-24 08:37:25.376 +00:00"
1649857842,288080,Gloves Giro MONACO II Gel RED sarung tangan gowes glove monton,584000.0,0.0,0.0,4,"2022-01-24 08:37:19.873 +00:00"
1650427576,10794173,Sarung Tangan Gel Setengah Jari Anti Licin Untuk Sepeda Gunung Dan,108500.0,0.0,0.0,0,"2022-01-24 08:37:25.562 +00:00"
1650782352,1267265,Sarung Tangan Sepeda Half Finger Shock Gel Absorber Size L -S169 Black,130900.0,0.0,0.0,0,"2022-01-24 08:37:21.728 +00:00"
1652521623,7936983,DQ016 Lem Kuku Palsu Tangan Kaki Gel Tape Cair 2gr Double Tape Kikir A,16000.0,0.0,0.0,0,"2022-01-24 08:37:20.456 +00:00"
1653458018,2435547,Mouse Pad Dengan Bantalan Pergelangan Tangan 3d Bahan Gel Silika,214370.0,0.0,0.0,0,"2022-01-24 08:37:24.326 +00:00"
1653615680,104087,BANTALAN PERGELANGAN TANGAN / WRIST PAD GEL KARKATER (8002800034),15000.0,0.0,0.0,1,"2022-01-24 08:37:20.456 +00:00"
1653904821,2435547,Vitame Wei Tower Honey Hand Gel 50ml Untuk Tangan Kering,178890.0,0.0,0.0,0,"2022-01-24 08:37:22.728 +00:00"
1654579426,4943143,Tree 50ml Hand Sanitizer Gel Anti Bakteri Ukuran Tangan/Portable,111600.0,0.0,0.0,0,"2022-01-24 08:37:22.327 +00:00"
1654815572,4943143,Sarung Tangan Gel Silikon Setengah Jari Anti Slip Untuk Bersepeda,126700.0,0.0,0.0,0,"2022-01-24 08:37:24.803 +00:00"
1656453379,4943143,Onola on6011 Jam Tangan Quartz Analog Dial Bulat Strap Silica Gel,411600.0,0.0,0.0,0,"2022-01-24 08:37:21.466 +00:00"
1659151431,10082853,TNSPD Sarung Tangan Sepeda Gel 3D Pearl Izumi,139000.0,0.0,0.0,0,"2022-01-24 08:37:25.376 +00:00"
1661530662,3007768,Sarung Tangan Pelindung Jari Bahan Kulit Imitasi Silika Gel Ukuran,561500.0,0.0,0.0,0,"2022-01-24 08:37:24.803 +00:00"
1663173300,2732812,Sarung Tangan gel setengah bersepeda/Motor Non-slip Gym Fitness,108600.0,0.0,0.0,0,"2022-01-24 08:37:23.082 +00:00"
1663557805,2732812,Sarung Tangan Insulated Bahan Silica Gel Untuk Microwave/Oven,122900.0,0.0,0.0,0,"2022-01-24 08:37:25.926 +00:00"
1663679086,2732812,-saku Sarung Tangan Setengah Jari Bahan Gel untuk Sepeda / Motor,123500.0,0.0,0.0,0,"2022-01-24 08:37:24.326 +00:00"
1664027363,2732812,Bantalan Gel Penyangga Pergelangan Tangan Warna Hitam Untuk Keyboard,124700.0,0.0,0.0,0,"2022-01-24 08:37:22.915 +00:00"
1664048164,2732812,Boodun Sarung Tangan Pria / Wanita Full Finger Dengan Gel Untuk,198400.0,0.0,0.0,0,"2022-01-24 08:37:22.728 +00:00"
1664099372,2732812,Sarung Tangan Gel Setengah Jari 3 Warna Ukuran S-Xl Untuk Bersepeda,119700.0,0.0,0.0,0,"2022-01-24 08:37:22.915 +00:00"
1665014739,2732812,Bantalan Gel Memory Foam Penyangga Pergelangan Tangan Untuk Keyboard,151700.0,0.0,0.0,0,"2022-01-24 08:37:24.140 +00:00"
1665027153,2732812,Stiker Fitness Gel Gear Abdominal Perut/Lengan Tangan untuk Melatih,346600.0,0.0,0.0,0,"2022-01-24 08:37:23.082 +00:00"
1665073508,2732812,Sarung Tangan Gel Setengah Jari Anti Slip Untuk Bersepeda,281400.0,0.0,0.0,0,"2022-01-24 08:37:22.915 +00:00"
1665172673,2732812,Mouse Pad Dengan Bantalan Pergelangan Tangan Bahan Silikon Gel Warna,122000.0,0.0,0.0,0,"2022-01-24 08:37:23.654 +00:00"
1666454806,9783262,Sarung Tangan Olahraga Gel Comfort Ukuran M,296000.0,0.0,0.0,0,"2022-01-24 08:37:21.301 +00:00"
1670449386,10421092,Dispenser Sabun Cair/Lotion/Gel Tangan Otomatis Ukuran 450ml Dengan,544600.0,0.0,0.0,0,"2022-01-24 08:37:25.713 +00:00"
1670588926,10421092,Sarung Tangan Gel Setengah Jari Ukuran XL untuk Bersepeda,127000.0,0.0,0.0,0,"2022-01-24 08:37:23.245 +00:00"
1670599525,10421092,"2020 Gel Pembersih Tangan Sekali Pakai Anti Bakteri Cepat Kering",92200.0,0.0,0.0,0,"2022-01-24 08:37:24.140 +00:00"
1670610245,10421092,st Bantalan Gel Hitam Nyaman Penyangga Pergelangan Tangan Untuk,123200.0,0.0,0.0,0,"2022-01-24 08:37:25.562 +00:00"
1671006281,10421092,Kaos KakiSarung Tangan Spa Dengan Gel Pelembab Warna Pink,246600.0,0.0,0.0,0,"2022-01-24 08:37:24.803 +00:00"
1671088119,10421092,Mouse Pad Dengan Bantalan Gel Pergelangan Tangan Bahan Silikon Untuk,109000.0,0.0,0.0,0,"2022-01-24 08:37:24.967 +00:00"
1672985885,4667894,Sarung tangan Mavic Ksyrium BlackWhite Gel size M L dan XL KODE,253000.0,0.0,0.0,0,"2022-01-24 08:37:24.967 +00:00"
1673354235,9306422,ROCKET THINK Sarung tangan - Gloves Zuna Men Ultimate Gel Premium,290000.0,0.0,0.0,0,"2022-01-24 08:37:24.967 +00:00"
1673398403,10258848,GIRO TESSA GEL BLACK PINK GLOVES SARUNG TANGAN SEPEDA,312000.0,0.0,0.0,2,"2022-01-24 08:37:19.588 +00:00"
1674496257,9712135,KL INA - Sarung Tangan Sepeda Gel ROCKBROS S169 Double Shockproof,219000.0,0.0,0.0,0,"2022-01-24 08:37:25.562 +00:00"
1674496674,9712135,KL INA - Sarung tangan sepeda GEL,232000.0,0.0,0.0,0,"2022-01-24 08:37:25.376 +00:00"
1674748321,10599353,Rockbros Sarung Tangan Sepeda Half Finger Shock Gel Absorber Size L,135000.0,0.0,0.0,0,"2022-01-24 08:37:21.301 +00:00"
1675444108,1431606,Sarung Tangan Sepeda Anti Slip 3D Shockproof Gel,55000.0,0.0,0.0,12,"2022-01-24 08:37:20.200 +00:00"
1677393848,1484250,Sarung Tangan Sepeda GEL Shockproof Original Star QQN Half Finger,52500.0,0.0,0.0,16,"2022-01-24 08:37:19.413 +00:00"
1677765769,4464681,Lucu Kartun Kelinci Gel Pena Alat Tulis Siswa Tanda Tangan Kreatif,72500.0,0.0,0.0,0,"2022-01-24 08:37:25.145 +00:00"
1677788991,4464681,"30ml Gel Pelembab Tangan Portable Anti Bakteri Wangi Buah",98800.0,0.0,0.0,0,"2022-01-24 08:37:25.713 +00:00"
1677934568,4464681,Dispenser Gel Tangan Otomatis Tanpa Sentuh Kapasitas 1200ml Untuk,2183800.0,0.0,0.0,0,"2022-01-24 08:37:24.803 +00:00"
1677943815,4464681,Sarung Tangan Gel Setengah Jari Ukuran XL 3 Warna untuk Sepeda /,126900.0,0.0,0.0,0,"2022-01-24 08:37:25.376 +00:00"
1678299017,4464681,Sarung Tangan gel sepeda versi upgrade dapat bernapas 1 Pair,123500.0,0.0,0.0,0,"2022-01-24 08:37:25.713 +00:00"
1678342010,4464681,Sarung Tangan Multifungsi Bahan Silica Gel Anti Slip Warna Acak,61600.0,0.0,0.0,0,"2022-01-24 08:37:22.728 +00:00"
1678725772,4464681,Pena Gel Bentuk Bulu Sakura Gaya Romantis Untuk Tanda Tangan,89300.0,0.0,0.0,0,"2022-01-24 08:37:25.145 +00:00"
1678768222,4464681,"1 Pasang Sarung Tangan Gel Setengah Jari Anti Slip Untuk Bersepeda",123900.0,0.0,0.0,0,"2022-01-24 08:37:25.145 +00:00"
1678964364,4464681,"1 Pasang Sarung Tangan Gel Pria Untuk Bersepeda/Ski/Lari",189700.0,0.0,0.0,0,"2022-01-24 08:37:22.915 +00:00"
1680004936,4464681,✿ Biking Sarung Tangan Gel Setengah Jari Untuk Bersepeda,164200.0,0.0,0.0,0,"2022-01-24 08:37:24.803 +00:00"
1680107074,8808217,Stiker Fitness Gel Gear Abdominal Perut/Lengan Tangan untuk Melatih,346600.0,0.0,0.0,0,"2022-01-24 08:37:21.131 +00:00"
1680148890,8808217,Lampu LED UV Mini Portable Pengering Kutek Gel/Perawatan Tangan,103000.0,0.0,0.0,0,"2022-01-24 08:37:21.131 +00:00"
1680210693,8808217,Avail-Sarung Tangan Gel Setengah Jari Ukuran S-Xl 3 Warna Untuk,122100.0,0.0,0.0,0,"2022-01-24 08:37:21.131 +00:00"
1680230123,10093095,Sarung Tangan sepeda roadbike glove palm GEL Ettix,179000.0,0.0,0.0,0,"2022-01-24 08:37:25.376 +00:00"
1680299823,8808217,Sarung Tangan Setengah Jari Dengan Gel 3 Warna Ukuran Bersepeda /,257400.0,0.0,0.0,0,"2022-01-24 08:37:21.131 +00:00"
1680316872,8808217,"1 Pasang Sarung Tangan Gel Pria Untuk Bersepeda/Ski/Lari",170900.0,0.0,0.0,0,"2022-01-24 08:37:22.560 +00:00"
1680323859,8808217,Sarung Tangan Gel Model Setengah Jari 3 Warna Ukuran S-Xl Untuk,118500.0,0.0,0.0,0,"2022-01-24 08:37:24.967 +00:00"
1680361260,8808217,Yiwuyuan Gelang Dispenser Cairan Gel Cuci Tangan Portable Untuk,140700.0,0.0,0.0,0,"2022-01-24 08:37:21.131 +00:00"
1680586957,8808217,caiDispenser Gel Cairan Cuci Tangan Untuk Anak Dan Dewasa,194600.0,0.0,0.0,0,"2022-01-24 08:37:21.131 +00:00"
1680623970,8808217,"4pcs Sarung Tangan Gel Unisex Setengah Jari Anti Slip Untuk Motor /",154300.0,0.0,0.0,0,"2022-01-24 08:37:21.131 +00:00"
1680689530,8808217,"1pc Sarung Tangan Unisex Model Setengah Jari Shockproof Bahan Gel",437800.0,0.0,0.0,0,"2022-01-24 08:37:21.131 +00:00"
1680711626,8808217,Sarung Tangan gel setengah bersepeda/Motor Non-slip Gym Fitness,104800.0,0.0,0.0,0,"2022-01-24 08:37:21.131 +00:00"
1680719219,8808217,✿ Biking Sarung Tangan Gel Setengah Jari Untuk Bersepeda,158800.0,0.0,0.0,0,"2022-01-24 08:37:24.967 +00:00"
1680736493,8808217,ww Sarung Tangan Setengah Jari Dengan Gel 3 Warna untuk Sepeda /,134500.0,0.0,0.0,0,"2022-01-24 08:37:21.131 +00:00"
1680765126,8808217,Sarung Tangan: Bentuk Setengah Jari Pendek Gel Untuk Mengendarai,145000.0,0.0,0.0,0,"2022-01-24 08:37:24.803 +00:00"
1680836988,8808217,Sarung Tangan Gel Setengah Jari Pendek Untuk Olahraga Bersepeda,126100.0,0.0,0.0,0,"2022-01-24 08:37:21.131 +00:00"
1680960691,8808217,Gelang Gel Silikon Pembersih Tangan Disinfeksi Multi Level Portabel,98000.0,0.0,0.0,0,"2022-01-24 08:37:21.131 +00:00"
1681039420,8808217,Pue 1 Pasang Sarung Tangan Full Finger Anti Slip Dengan Bantalan Gel,111100.0,0.0,0.0,0,"2022-01-24 08:37:21.131 +00:00"
1683315260,11101585,Sarung Tangan Sepeda Padding Liquid GEL GIYO S10G,221000.0,0.0,0.0,0,"2022-01-24 08:37:19.873 +00:00"
1685317009,7932470,HANDSANITIZER KONICARE gel pembersih tangan konicare,19000.0,0.0,0.0,0,"2022-01-24 08:37:24.140 +00:00"
1685427132,9783674,Sarung Tangan Sepeda dgn Gel utk Fitness Gym Pria Wanita Terbaru,175000.0,0.0,0.0,12,"2022-01-24 08:37:19.413 +00:00"
1685622326,2904874,Sarung Tangan Sepeda Half Finger Shock Gel Absorber Size L Rockbros,212700.0,0.0,0.0,0,"2022-01-24 08:37:21.466 +00:00"
1687101600,7532621,Kompres Gel Pack Penghangat Tangan Portable Reusable Heat Pack,14573.0,0.0,0.0,8,"2022-01-24 08:37:19.588 +00:00"
1687706183,10442393,Sarung Tangan Sepeda Pearl Izumi - Cycling Glove Silicone Gel kode BF,167000.0,0.0,0.0,0,"2022-01-24 08:37:24.803 +00:00"
1687908749,5547049,NP 60ml Gel Pelembab Tangan Sekali Pakai,80764.0,0.0,0.0,0,"2022-01-24 08:37:23.245 +00:00"
1688714720,9669058,ROSARIO - Sarung tangan Mavic Ksyrium Gel size M dan L Flo Green,232000.0,0.0,0.0,0,"2022-01-24 08:37:25.376 +00:00"
1688714724,9669058,ROSARIO - Sarung tangan Mavic Ksyrium BlackWhite Gel size M L dan XL,232000.0,0.0,0.0,0,"2022-01-24 08:37:24.803 +00:00"
1689212308,8134419,Sarung Tangan Sepeda Setengah Jari Bike Glove Silicone Gel,45000.0,0.0,0.0,2,"2022-01-24 08:37:19.588 +00:00"
1689258146,10270306,Terlaris dr Soap GEL 500 ml pembersih tangan,216125.0,0.0,0.0,0,"2022-01-24 08:37:22.069 +00:00"
1690375191,2908650,Giro Monaco Ii 3pcs Sarung Tangan Setengah Jari Bahan Kulit Gel,1232900.0,0.0,0.0,0,"2022-01-24 08:37:22.560 +00:00"
1690375243,2908650,Giro Bravo Sarung Tangan Gel Setengah Jari Shockproof,1097800.0,0.0,0.0,0,"2022-01-24 08:37:22.560 +00:00"
1690704756,2908650,Sarung Tangan Gel Setengah Jari Untuk Sepeda MTB / Balap Ukuran S /,134400.0,0.0,0.0,0,"2022-01-24 08:37:25.562 +00:00"
1691034956,2908650,Jam Tangan Quartz Casual Dial Bulat Strap Silica Gel untuk Pasangan,92800.0,0.0,0.0,0,"2022-01-24 08:37:22.327 +00:00"
1691145686,5652721,"30ml Botol Dispenser Gel Cairan Pembersih Tangan Portable Model",69500.0,0.0,0.0,0,"2022-01-24 08:37:24.326 +00:00"
1691928784,10561962,"Sarung Tangan Gel Setenga, Fitnes, Sepeda/Motor Anti Slip(90GR)ACC0043",32000.0,0.0,0.0,4,"2022-01-24 08:37:20.200 +00:00"
1692229724,7066311,Sepeda Motor Bersepeda sarung tangan gel setengah jari Sepeda sarung,263600.0,0.0,0.0,0,"2022-01-24 08:37:25.562 +00:00"
1692418886,7066311,Laki-laki Glove Sarung Tangan gel setengah bersepeda/Motor Non-slip,99400.0,0.0,0.0,0,"2022-01-24 08:37:25.376 +00:00"
1692418913,7066311,Mountain Laki-laki Glove Sarung Tangan gel setengah bersepeda/Motor,99400.0,0.0,0.0,0,"2022-01-24 08:37:24.967 +00:00"
1692916969,7066311,STARQQN Sarung Tangan Olahraga dengan 3D Shockproof Gel Size L,98500.0,0.0,0.0,0,"2022-01-24 08:37:24.140 +00:00"
1694310349,8972856,iNSTANCE GEL HAND SANITIZER 500ML | PENCUCI TANGAN,46880.0,0.0,0.0,0,"2022-01-24 08:37:20.714 +00:00"
1695759683,9391906,Sarung Tangan Glove Giro BRAVO Gel kode 2199,543000.0,0.0,0.0,0,"2022-01-24 08:37:22.915 +00:00"
1697214682,4667894,Sarung Tangan Gloves GiIRO Stradedure Super Gel Original KODE 1302,470000.0,0.0,0.0,0,"2022-01-24 08:37:25.713 +00:00"
1697292003,780605,Sarung Tangan Gowes Sepeda Full Fingger Gel Padding Not Pearl Izumi,99000.0,0.0,0.0,7,"2022-01-24 08:37:19.588 +00:00"
1700305951,9712135,KL INA - sarung tangan shimano gel,144000.0,0.0,0.0,0,"2022-01-24 08:37:23.245 +00:00"
1700840244,8718084,"1pc Dispenser Cairan Pembersih Tangan Dengan Bahan Gel Silika Untuk",117400.0,0.0,0.0,0,"2022-01-24 08:37:24.967 +00:00"
1701088210,9448139,ANTIS GEL Pembersih Tangan 30ml,7000.0,0.0,0.0,2,"2022-01-24 08:37:19.588 +00:00"
1701368426,8718084,Sarung Tangan Bahan Silica Gel Motif Polkadot Besar Tahan Suhu,142800.0,0.0,0.0,0,"2022-01-24 08:37:24.967 +00:00"
1701570896,8718084,Sarung Tangan Gel Setengah Jari Anti Slip / Shock Untuk Bersepeda,208300.0,0.0,0.0,0,"2022-01-24 08:37:23.829 +00:00"
1701754565,8718084,Twinkle1.Id Sarung Tangan Sepeda Half Finger Dengan Pad Gel Untuk,151400.0,0.0,0.0,0,"2022-01-24 08:37:25.376 +00:00"
1701891392,8718084,Lampu LED UV Mini Portable Pengering Kutek Gel/Perawatan Tangan,105100.0,0.0,0.0,0,"2022-01-24 08:37:25.713 +00:00"
1701973997,6877269,Twinkle1.Id Sarung Tangan Sepeda Half Finger Dengan Pad Gel Untuk,151400.0,0.0,0.0,0,"2022-01-24 08:37:25.376 +00:00"
1701995340,8718084,Dispenser Gel Cuci Tangan Portabel Sekali Pakai Bahan Silikon,92400.0,0.0,0.0,0,"2022-01-24 08:37:24.967 +00:00"
1702479342,6877269,Dispenser Gel Cuci Tangan Portabel Sekali Pakai Bahan Silikon,92400.0,0.0,0.0,0,"2022-01-24 08:37:24.967 +00:00"
1712543159,9048779,ZRPHS Glove - Sarung Tangan Shimano Gel Red,149000.0,0.0,0.0,0,"2022-01-24 08:37:23.829 +00:00"
1712616235,8838920,JNHID Gloves Cycliste Gel Sarung Tangan Sepeda,174000.0,0.0,0.0,0,"2022-01-24 08:37:25.376 +00:00"
1714042153,2041415,STARQQN Sarung Tangan Olahraga dengan 3D Shockproof Gel,47880.0,0.0,0.0,1,"2022-01-24 08:37:21.466 +00:00"
1714486439,9391906,Sarung Tangan Glove Giro MONACO II Gel kode 2199,794000.0,0.0,0.0,0,"2022-01-24 08:37:24.492 +00:00"
1715085473,11161211,Terlaris Sarung Tangan Sepeda Gel Silicone Pad Double Shockproof,200000.0,0.0,0.0,0,"2022-01-24 08:37:20.714 +00:00"
1715310366,5418397,NUVO HAND SANITIZER ANTI BACTERIAL GEL PEMBERSIH TANGAN,5300.0,0.0,0.0,1,"2022-01-24 08:37:20.200 +00:00"
1715470950,4667894,SARUNG TANGAN SEPEDA ZUNA SPORT MEN ULTIMATE GEL PREMIUM HALF FINGER,332000.0,0.0,0.0,0,"2022-01-24 08:37:25.926 +00:00"
1717436490,9916117,family toys KOMPRES GEL PENGHANGAT TANGAN instan portable travel hand,12000.0,0.0,0.0,2,"2022-01-24 08:37:19.413 +00:00"
1719027735,326618,Sea Sarung Tangan Gel Setengah Jari Ukuran XL 3 Warna untuk Sepeda /,302080.0,0.0,0.0,0,"2022-01-24 08:37:23.829 +00:00"
1719282910,326618,RockBros Sarung Tangan Gel Setengah Jari Breathable Anti Shock untuk,333480.0,0.0,0.0,0,"2022-01-24 08:37:25.562 +00:00"
1721334502,10874744,STARQQN Sarung Tangan Olahraga dengan 3D Shockproof Gel,47900.0,0.0,0.0,2,"2022-01-24 08:37:19.873 +00:00"
1721990492,8878064,Sarung Tangan Sepeda Gel Toppro bisa Motor Gym Fitness Senam olahraga,34000.0,0.0,0.0,0,"2022-01-24 08:37:20.200 +00:00"
1722422911,10282328,Sarung Tangan Sepeda Gel 3D Pearl Izumi,165000.0,0.0,0.0,0,"2022-01-24 08:37:23.654 +00:00"
1722802350,2330780,"1 Pasang Sarung Tangan Bahan Gel Silikon untuk Arthritis / Radang",107100.0,0.0,0.0,0,"2022-01-24 08:37:23.654 +00:00"
1723329736,1721312,sarung tangan gel setengah sepeda motor non-slip gym fitness mountain,29000.0,0.0,0.0,11,"2022-01-24 08:37:19.413 +00:00"
1723562326,2330780,Mk034 Sarung Tangan Half Finger Bahan Silica Gel Anti Shock Untuk,136900.0,0.0,0.0,0,"2022-01-24 08:37:24.492 +00:00"
1723643962,2330780,Giyo Sarung Tangan Pria/Wanita Full Finger Dengan Gel Bisa Touch,256500.0,0.0,0.0,0,"2022-01-24 08:37:24.803 +00:00"
1725073099,2330780,Sarung Tangan Multifungsi Bahan Silika Gel Anti Slip Warna Acak,81100.0,0.0,0.0,0,"2022-01-24 08:37:25.145 +00:00"
1725257274,2330780,Bantalan Pergelangan Tangan Bahan Memory Foam Gel 3D Anti Slip untuk,186400.0,0.0,0.0,0,"2022-01-24 08:37:23.082 +00:00"
1725262508,2330780,"1 Pasang Sarung Tangan Setengah Jari Dengan Gel Pelembab Warna Pink",135200.0,0.0,0.0,0,"2022-01-24 08:37:24.967 +00:00"
1725350390,2258544,Sarung Tangan Bahan Silica Gel Motif Polkadot Besar Tahan Suhu,148400.0,0.0,0.0,0,"2022-01-24 08:37:24.803 +00:00"
1725432427,2330780,Sarung Tangan gel setengah bersepeda/Motor Non-slip Gym Fitness,107100.0,0.0,0.0,0,"2022-01-24 08:37:25.713 +00:00"
1725432437,2330780,Glove Sarung Tangan gel setengah bersepeda/Motor Non-slip Gym,107100.0,0.0,0.0,0,"2022-01-24 08:37:25.713 +00:00"
1725432508,2330780,Laki-laki Glove Sarung Tangan gel setengah bersepeda/Motor Non-slip,107100.0,0.0,0.0,0,"2022-01-24 08:37:23.245 +00:00"
1725432530,2330780,Sarung Tangan gel sepeda versi upgrade dapat bernapas 1 Pair,125000.0,0.0,0.0,0,"2022-01-24 08:37:23.245 +00:00"
1725432758,2330780,Fitness Mountain Laki-laki Glove Sarung Tangan gel setengah,107100.0,0.0,0.0,0,"2022-01-24 08:37:22.915 +00:00"
1725661987,2330780,✿ Biking Sarung Tangan Gel Setengah Jari Untuk Bersepeda,160400.0,0.0,0.0,0,"2022-01-24 08:37:25.713 +00:00"
1725783388,1551177,Sarung Tangan Multifungsi Bahan Silika Gel Anti Slip Warna Acak,81100.0,0.0,0.0,0,"2022-01-24 08:37:24.967 +00:00"
1725944134,10735760,Sarung Tangan Multifungsi Bahan Silika Gel Anti Slip Warna Acak,81100.0,0.0,0.0,0,"2022-01-24 08:37:25.376 +00:00"
1726055105,1551177,Sarung Tangan Bahan Silica Gel Motif Polkadot Besar Tahan Suhu,142800.0,0.0,0.0,0,"2022-01-24 08:37:24.140 +00:00"
1726692441,1551177,Sarung Tangan Gel Setengah Jari Anti Licin Untuk Bersepeda Gunung /,111000.0,0.0,0.0,0,"2022-01-24 08:37:25.926 +00:00"
1726773260,1551177,Blesiya1 Mouse Pad Dengan Bantalan Pergelangan Tangan Bahan Gel,187000.0,0.0,0.0,0,"2022-01-24 08:37:24.326 +00:00"
