"skuId","shopId","productName","discountedPrice","originalPrice","rating","soldCount","createdAt"
2548838154,9484355,Pulpen Gel Isi Ulang Ukuran 0.5mm Untuk Tanda Tangan,39100.0,0.0,0.0,0,"2022-01-24 08:37:22.728 +00:00"
2549222681,9484355,Pena Gel Bentuk Bulu Sakura Untuk Tanda Tangan Pesta Pernikahan,55200.0,0.0,0.0,0,"2022-01-24 08:37:24.967 +00:00"
2549232547,4710428,Mouse Pad Dengan Bantalan Pergelangan Tangan Bahan Gel Anti Slip,108688.0,0.0,0.0,0,"2022-01-24 08:37:23.082 +00:00"
2549257986,9484355,Pulpen Gel Bentuk Senjata Pedang Kreatif Untuk Menulistanda Tangan,55900.0,0.0,0.0,0,"2022-01-24 08:37:24.967 +00:00"
2549385766,10530902,Tolonghot Cover Rem Tangan Mobil Universal Bahan Gel Silikon Anti Slip,54400.0,0.0,0.0,0,"2022-01-24 08:37:23.654 +00:00"
2549775342,2156280,Willis1 Gelang Tangan Dispenser Portable Bahan Silica Gel Untuk Trave,100998.0,0.0,0.0,0,"2022-01-24 08:37:23.654 +00:00"
2550199939,2156280,Tak Mouse Pad Dengan Bantalan Gel Pergelangan Tangan Desain Ergonomis,110857.0,0.0,0.0,0,"2022-01-24 08:37:23.082 +00:00"
2550286657,961736,(Imm) 1 Pasang Cover Pelindung Tuas Rem Tangan Universal Bahan Gel Sil,70226.0,0.0,0.0,0,"2022-01-24 08:37:22.069 +00:00"
2550309647,2156280,Z-SPORT/Baru Kamuflase keel gel tangan Grip non-slip sweatband Kentalk,51322.0,0.0,0.0,0,"2022-01-24 08:37:23.082 +00:00"
2550570841,4710428,(Predolo2) Mouse Pad Gel Anti Slip Dengan Bantalan Pergelangan Tangan,63371.0,0.0,0.0,0,"2022-01-24 08:37:23.082 +00:00"
2550622960,4710428,Mouse Pad Dengan Bantalan Pergelangan Tangan Bahan Gel Motif Telapak,189813.0,0.0,0.0,0,"2022-01-24 08:37:22.915 +00:00"
2550903741,4710428,Cupuka Bantalan Gel Penyangga Pergelangan Tangan Warna Hitam Untuk Key,108752.0,0.0,0.0,0,"2022-01-24 08:37:22.915 +00:00"
2551007152,4710428,Mouse Pad Gel Tembus Pandang Dengan Bantalan Pergelangan Tangan Untuk,111938.0,0.0,0.0,0,"2022-01-24 08:37:22.069 +00:00"
2551756883,4710428,Sarung Tangan Jari Pendek Bahan Gel Cair Anti Shock Untuk Berkendara,231423.0,0.0,0.0,0,"2022-01-24 08:37:22.069 +00:00"
2552127284,4710428,Xianyuan Mouse Pad Dengan Bantalan Pergelangan Tangan Bahan Gel Motif,202740.0,0.0,0.0,0,"2022-01-24 08:37:23.082 +00:00"
2552419814,336674,Super Murah CoolChange Sarung Tangan Sepeda Silicone Gel Pad,343000.0,0.0,0.0,0,"2022-01-24 08:37:25.926 +00:00"
2552687572,961736,(Wyl) Mouse Pad Dengan Bantalan Pergelangan Tangan Bahan Gel Silikon M,200083.0,0.0,0.0,0,"2022-01-24 08:37:21.301 +00:00"
2552738798,4710428,Mouse Pad Dengan Gel Pergelangan Tangan Ergonomis Untuk Gaming,108768.0,0.0,0.0,0,"2022-01-24 08:37:22.915 +00:00"
2552830329,6995363,Cetakan Kerajinan Tangan Diy Bahan Silika Gel Tidak Beracun Tahan,66600.0,0.0,0.0,0,"2022-01-24 08:37:25.562 +00:00"
2552923300,4710428,Luckyx Bantalan Gel Nyaman Penyangga Pergelangan Tangan Untuk Keyboard,120039.0,0.0,0.0,0,"2022-01-24 08:37:21.466 +00:00"
2553132016,9428203,Bang Mouse Pad Dengan Bantalan Gel Pergelangan Tangan Ergonomis,118900.0,0.0,0.0,0,"2022-01-24 08:37:25.145 +00:00"
2553179560,2387724,Antis Hand Sanitizer Gel - Pembersih Tangan Tanpa Bilas,2500.0,0.0,0.0,22,"2022-01-24 08:37:19.873 +00:00"
2553371874,11473479,Tangan Gratis Titanium Karat Pic Real COD Anti bayar Ongkir Rantai Gel,147400.0,0.0,0.0,0,"2022-01-24 08:37:23.082 +00:00"
2553787967,6995363,Cover Rem Tangan Mobil Universal Bahan Silikon Gel Anti Slip,65400.0,0.0,0.0,0,"2022-01-24 08:37:25.926 +00:00"
2553889713,9669058,RS Official ROCKBROS Sarung Tangan Half Finger Shookprof Gel S169 -,232000.0,0.0,0.0,0,"2022-01-24 08:37:23.082 +00:00"
2553890663,4710428,Bantalan Gel Penyangga Pergelangan Tangan Motif Telapak Kaki Kucing U,205572.0,0.0,0.0,0,"2022-01-24 08:37:23.654 +00:00"
2554001527,961736,Cetakan Kerajinan Tangan Diy Bahan Silika Gel Tidak Beracun Tahan Koro,59913.0,0.0,0.0,0,"2022-01-24 08:37:21.466 +00:00"
2554274383,4710428,Fbid Bantalan Gel Penyangga Pergelangan Tangan Warna Hitam Untuk Keybo,111556.0,0.0,0.0,0,"2022-01-24 08:37:22.915 +00:00"
2554666610,4710428,Win Mouse Pad Dengan Bantalan Gel Pergelangan Tangan Untuk Gaming / Ka,101739.0,0.0,0.0,0,"2022-01-24 08:37:22.915 +00:00"
2554912786,2156280,"5 Buah Gel Pena Warna Tangan Akun Macaron Warna Perlengkapan Sekolah",72232.0,0.0,0.0,0,"2022-01-24 08:37:22.915 +00:00"
2554913015,2156280,XIJING 5 buah 0.5mm Pena Gel Tinta Hitam | Alat Tulis Tanda Tangan Kan,63710.0,0.0,0.0,0,"2022-01-24 08:37:22.069 +00:00"
2554936328,6228567,Cover Rem Tangan Mobil Universal Bahan Silikon Gel Anti Slip,56750.0,0.0,0.0,0,"2022-01-24 08:37:25.145 +00:00"
2555126405,9585514,GIYO Sarung Tangan Sepeda Gel Full Finger S02L Original,115000.0,150000.0,0.0,18,"2022-01-24 08:37:19.588 +00:00"
2555135810,9585514,Sarung Tangan Sepeda Padding Liquid GEL GIYO S10G Original,139000.0,180000.0,0.0,5,"2022-01-24 08:37:19.588 +00:00"
2555164831,6111557,Silicon Gel Mouse Pad Dukungan Pergelangan Tangan Kantor DBLS,514615.0,0.0,0.0,0,"2022-01-24 08:37:25.145 +00:00"
2555242180,2156280,"5 buah 0.5mm Pena Gel Tinta Hitam | Alat Tulis Tanda Tangan Kantor Sis",63710.0,0.0,0.0,0,"2022-01-24 08:37:23.082 +00:00"
2555380238,2156280,"6 Buah/Set Kartun Press Gel Pulpen Mahasiswa Ujian Tanda Tangan Hitam",82974.0,0.0,0.0,0,"2022-01-24 08:37:22.069 +00:00"
2555406767,4710428,(Mq) Mouse Pad Dengan Bantalan Pergelangan Tangan Bahan Gel Motif Tel,197427.0,0.0,0.0,0,"2022-01-24 08:37:22.915 +00:00"
2555409100,4710428,"1 Pasang Sarung Tangan Pelindung Rem Sepeda Bahan Gel",62285.0,0.0,0.0,0,"2022-01-24 08:37:23.654 +00:00"
2555467678,6995363,Mouse Pad Dengan Bantalan Gel Pergelangan Tangan Ergonomis Warna,109600.0,0.0,0.0,0,"2022-01-24 08:37:23.245 +00:00"
2555478944,9484355,Pulpen Gel Lucu Untuk Tanda Tangan Sekolah Kantor,72600.0,0.0,0.0,0,"2022-01-24 08:37:25.562 +00:00"
2555491932,9484355,XIJING 5 buah 0.5mm Pena Gel Tinta Hitam Alat Tulis Tanda Tangan Kanto,40100.0,0.0,0.0,0,"2022-01-24 08:37:24.326 +00:00"
2555533794,9085891,NEW! Sarung Tangan Glove Giro BRAVO Gel,495000.0,0.0,0.0,0,"2022-01-24 08:37:23.654 +00:00"
2555546352,9085891,NEW! Sarung Tangan Gloves GiIRO Stradedure Super Gel Original,440000.0,0.0,0.0,0,"2022-01-24 08:37:24.140 +00:00"
2555660754,9484355,Pulpen Gel Warna Pink Bahan Metal Untuk Tanda Tangan Hadiah Z2I9,49000.0,0.0,0.0,0,"2022-01-24 08:37:22.560 +00:00"
2555782062,6966142,Pulpen Tinta Gel Hitam Bahan Karbon Fiber Untuk Tanda Tangan / Bisnis,103600.0,0.0,0.0,0,"2022-01-24 08:37:23.654 +00:00"
2555795846,6966142,Pulpen Tinta Gel Metal Mewah Untuk Tanda Tangan / Stationery Kantor /,100500.0,0.0,0.0,0,"2022-01-24 08:37:24.140 +00:00"
2555948157,9484355,"6 Buah Set Kartun Press Gel Pulpen Mahasiswa Ujian Tanda Tangan Hitam",61000.0,0.0,0.0,0,"2022-01-24 08:37:24.803 +00:00"
2556004010,4710428,"1pc Pulpen Gel Metal Kreatif 3 Warna Untuk Tanda Tangan U2T7",49667.0,0.0,0.0,0,"2022-01-24 08:37:21.301 +00:00"
2556125320,9484355,"4pcs Pulpen Gel Bentuk Kaktus Untuk Tanda Tangan Kantor Pelajar",54000.0,0.0,0.0,0,"2022-01-24 08:37:21.131 +00:00"
2556218610,4710428,Otid Mouse Pad Dengan Bantalan Pergelangan Tangan Bahan Gel Motif Tel,210902.0,0.0,0.0,0,"2022-01-24 08:37:22.069 +00:00"
2556242551,961736,"1 Pasang Sarung Tangan Pelindung Jari Kaki Bahan Silikon Gel",50969.0,0.0,0.0,0,"2022-01-24 08:37:22.915 +00:00"
2556287101,4710428,(Myhot) Bantalan Gel Hitam Penyangga Pergelangan Tangan Untuk Keyboard,110305.0,0.0,0.0,0,"2022-01-24 08:37:22.915 +00:00"
2556378737,9484355,Yu 5pcs Isi Ulang Pulpen Gel 0.5mm Untuk Tanda Tangan Sekolah,65400.0,0.0,0.0,0,"2022-01-24 08:37:22.728 +00:00"
2556413391,6804723,"12/24/36 Warna Cat Air Pena Lukisan Tangan Pena Gel Pena 0.3mm Art Pen",159500.0,0.0,0.0,0,"2022-01-24 08:37:21.131 +00:00"
2556417055,9484355,"5 Pcs Set Pena Gel Highlighter Model Tekan Tangan Gaya Retro Untuk Ala",58000.0,0.0,0.0,0,"2022-01-24 08:37:25.376 +00:00"
2556466460,9484355,Pulpen Gel Tinta Hitam Transparan 0.5mm Untuk Tanda Tangan Sekolah,68600.0,0.0,0.0,0,"2022-01-24 08:37:21.131 +00:00"
2556509500,9484355,Goo 4pcs Pulpen Gel Netral Bentuk Kucing Untuk Tanda Tangan Sekolah Ka,66100.0,0.0,0.0,0,"2022-01-24 08:37:23.245 +00:00"
2556539554,1271035,Dispenser Gel Tangan Otomatis Non Kontak 2200ml Dapat Diisi Ulang,618000.0,0.0,0.0,0,"2022-01-24 08:37:25.376 +00:00"
2556558352,6804723,Waydeer Mouse Pergelangan Tangan Rest 130 × 60mm Gel Nonslip Sandaran,332500.0,0.0,0.0,0,"2022-01-24 08:37:23.654 +00:00"
2556565605,9484355,Sel Pulpen Gel 0.5mm Bahan Metal Untuk Tanda Tangan Kantor Sekolah,68400.0,0.0,0.0,0,"2022-01-24 08:37:23.829 +00:00"
2556580044,1271035,Botol Dispenser Sabun Gel Tangan Bahan Plastik Stainless Steel 1000ml,704000.0,0.0,0.0,0,"2022-01-24 08:37:24.140 +00:00"
2556580949,6804723,Clear Silicone Gel Keyboard Pergelangan Tangan Pad untuk Meja Kantor D,375500.0,0.0,0.0,0,"2022-01-24 08:37:21.131 +00:00"
2556586217,9484355,"10pcs Lot Pulpen Gel 0.38mm Lucu Untuk Menulis Tanda Tangan Sekolah",85600.0,0.0,0.0,0,"2022-01-24 08:37:24.967 +00:00"
2556620215,4710428,Lem Tembak Tangan Termostat 20w Bahan Silica Gel Untuk Kaca,120154.0,0.0,0.0,0,"2022-01-24 08:37:23.082 +00:00"
2556653585,9484355,emmoo 0.5mm Morandi Gel Pena Multicolor Gel Pena Tangan Akun Pena Alat,112700.0,0.0,0.0,0,"2022-01-24 08:37:25.562 +00:00"
2556696275,10038647,Pulpen Gel Warna Pink Bahan Metal Untuk Tanda Tangan Hadiah F5R3,43500.0,0.0,0.0,0,"2022-01-24 08:37:22.560 +00:00"
2556701674,10038647,"2pcs Pulpen Gel Roller Ball 0.5mm 4 Warna Untuk Menulis Tanda Tangan S",58000.0,0.0,0.0,0,"2022-01-24 08:37:24.492 +00:00"
2556707173,10038647,Pulpen Gel Desain Kaktus Kartun Lucu Gaya Korea Untuk Tanda Tangan M4M,58000.0,0.0,0.0,0,"2022-01-24 08:37:23.654 +00:00"
2556707388,10038647,"1pc Pulpen Gel Metal Kreatif 3 Warna Untuk Tanda Tangan U2T7",55200.0,0.0,0.0,0,"2022-01-24 08:37:22.327 +00:00"
2556712436,10038647,Kartun gel pena Lucu es krim Bentuk macarons pena tanda tangan Haagen,55400.0,0.0,0.0,0,"2022-01-24 08:37:21.131 +00:00"
2556727239,10038647,"10pcs Lot Isi Ulang Pulpen Tinta Gel Warna Putih Untuk Tanda Tangan Se",58000.0,0.0,0.0,0,"2022-01-24 08:37:24.326 +00:00"
2556732305,10038647,Pulpen Gel Tinta Warna Laser Mermaid Untuk Tanda Tangan Anak Perempuan,55600.0,0.0,0.0,0,"2022-01-24 08:37:21.131 +00:00"
2556743815,10038647,Pulpen Gel Isi Ulang Ukuran 0.5mm Untuk Tanda Tangan,49100.0,0.0,0.0,0,"2022-01-24 08:37:22.560 +00:00"
2556749503,9484355,Gel Pena0.5Tes Siswa Pulpen Kantor Hitam Pena Tanda Tangan Pena Berbas,183000.0,0.0,0.0,0,"2022-01-24 08:37:21.131 +00:00"
2556753663,9484355,Gel Pena0.5Peluru Hitam Ballpoint Pena Tanda Tangan Pena Siswa Ujian K,228000.0,0.0,0.0,0,"2022-01-24 08:37:21.131 +00:00"
2556761218,9484355,Tanda tangan pena pena kantor pena gel counter desktop dapat disisipka,105000.0,0.0,0.0,0,"2022-01-24 08:37:24.967 +00:00"
2556775588,9484355,Pulpen Gel Hitam 0.38mm Model Kartun Korea Untuk Tanda Tangan pelajar,91800.0,0.0,0.0,0,"2022-01-24 08:37:24.803 +00:00"
2556845259,4710428,Rr Mouse Pad Ergonomik Dengan Bantalan Gel Pergelangan Tangan Untuk Ga,107906.0,0.0,0.0,0,"2022-01-24 08:37:22.915 +00:00"
2556855479,10038647,Pena Gel Bentuk Bulu Sakura Untuk Tanda Tangan Pesta Pernikahan,65200.0,0.0,0.0,0,"2022-01-24 08:37:24.803 +00:00"
2556867568,10038647,Pulpen Gel Bentuk Senjata Pedang Kreatif Untuk Menulistanda Tangan,65900.0,0.0,0.0,0,"2022-01-24 08:37:24.803 +00:00"
2556951895,10038647,Pulpen Gel Tinta Hitam Ujung 0.38mm Bahan Karbon Untuk Tanda Tangan Se,72000.0,0.0,0.0,0,"2022-01-24 08:37:25.376 +00:00"
2556967901,1271035,Dispenser Gel Tangan Otomatis Tanpa Sentuh Kapasitas 1200ml Untuk Meng,1418000.0,0.0,0.0,0,"2022-01-24 08:37:23.654 +00:00"
2557071216,6728226,tangan gym gel sarung S106 gloves finger half sepeda original,131400.0,0.0,0.0,0,"2022-01-24 08:37:24.326 +00:00"
2557265011,10622537,PEARL IZUMI Half Gloves Gel Non Slip Sarung Tangan Sepeda Setengah,144900.0,0.0,0.0,0,"2022-01-24 08:37:25.926 +00:00"
2557349451,10622537,Bagus Sarung Tangan Sepeda Half Finger gel Pearl Izumi Setengah Jari,152300.0,0.0,0.0,0,"2022-01-24 08:37:25.713 +00:00"
2557405835,961736,Cre Gel Pembersih Tangan Tanpa Kontak Mount Dinding,398262.0,0.0,0.0,0,"2022-01-24 08:37:21.466 +00:00"
2557442238,10622537,Jual ROCKBROS Sarung Tangan Gloves Half Finger Gel,174400.0,0.0,0.0,0,"2022-01-24 08:37:25.713 +00:00"
2557516696,961736,Pulpen Gel Mewah Bahan Metal Warna Hitam Untuk Tanda Tangan,50264.0,0.0,0.0,0,"2022-01-24 08:37:21.301 +00:00"
2558316026,152791,BUY 1 GET 1 - ANTIS ANTISEPTIC GEL PEMBERSIH TANGAN 60ML,7500.0,0.0,0.0,0,"2022-01-24 08:37:21.728 +00:00"
2558359405,10317682,BONTRAGER CIRCUIT TWIN GEL Gloves / Sarung Tangan Sepeda - Black,325000.0,0.0,0.0,1,"2022-01-24 08:37:20.714 +00:00"
2558370024,10317682,BONTRAGER CIRCUIT TWIN GEL Gloves / Sarung Tangan Sepeda - Black/White,325000.0,0.0,0.0,0,"2022-01-24 08:37:20.714 +00:00"
2558400182,10317682,BONTRAGER SOLSTICE GEL Gloves / Sarung Tangan Sepeda - Black,295000.0,0.0,0.0,1,"2022-01-24 08:37:20.714 +00:00"
2558513496,961736,Erid 1 Set Pulpen Gel Bahan Metal Untuk Tanda Tangan / Bisnis / Kantor,51803.0,0.0,0.0,0,"2022-01-24 08:37:21.301 +00:00"
2558800693,1126680,BUY 1 GET 1 FREE ANTIS ANTISEPTIC GEL PEMBERSIH TANGAN,7500.0,0.0,0.0,0,"2022-01-24 08:37:20.976 +00:00"
2558883026,961736,(Baoblaze1) Bantal Sandaran Tangan / Siku Bahan Busa Gel Untuk Kursi,157427.0,0.0,0.0,0,"2022-01-24 08:37:21.301 +00:00"
2558897854,336674,Bantalan Pergelangan Tangan Bahan Silikon Gel Motif Cakar Kucing,236900.0,0.0,0.0,0,"2022-01-24 08:37:23.654 +00:00"
2559042932,961736,Bsid Mouse Pad Dengan Bantalan Pergelangan Tangan Bahan Gel Motif Tel,199197.0,0.0,0.0,0,"2022-01-24 08:37:21.301 +00:00"
2559895791,9428203,"1 Pasang Sarung Tangan Pelindung Jari Kaki Bahan Gel Silikon Untuk",96600.0,0.0,0.0,0,"2022-01-24 08:37:24.803 +00:00"
2560066047,961736,Bantalan Gel Penyangga Pergelangan Tangan Motif Telapak Kaki Kucing U,205572.0,0.0,0.0,0,"2022-01-24 08:37:21.301 +00:00"
2560513960,9484355,Toko Roti Tekan Warna Gel Pena0.5mmPeluru Tanda Tangan Pena Retro Cata,403000.0,0.0,0.0,0,"2022-01-24 08:37:24.326 +00:00"
2560586942,961736,Bang Mouse Pad Dengan Bantalan Gel Pergelangan Tangan Ergonomis Untuk,108966.0,0.0,0.0,0,"2022-01-24 08:37:21.466 +00:00"
2560598238,10038647,XIJING 5 buah 0.5mm Pena Gel Tinta Hitam Alat Tulis Tanda Tangan Kanto,50100.0,0.0,0.0,0,"2022-01-24 08:37:24.326 +00:00"
2560720514,9484355,Toko Roti Gel Pena Tanda Tangan Pena Konferensi Bisnis Pena0.5mmHitam,297400.0,0.0,0.0,0,"2022-01-24 08:37:23.245 +00:00"
2560758363,9484355,Chenqi Gel Pena12PackHitam0.5mmTanda Tangan Pena Bola Peluru Pena Karb,323000.0,0.0,0.0,0,"2022-01-24 08:37:22.560 +00:00"
2560860140,12600922,Hand Gel Apple SR12 100ml Handsanitizer Pembersih Tangan Kuman Virus,35000.0,0.0,0.0,0,"2022-01-24 08:37:22.069 +00:00"
2560863554,9484355,Gaya cina retro warna tekan batang bulat pena gel akun tangan siswa pe,380300.0,0.0,0.0,0,"2022-01-24 08:37:21.131 +00:00"
2560865012,9484355,Tekan pena gel 0.5m pena air pena bolpoin hitam Pena tanda tangan karb,372400.0,0.0,0.0,0,"2022-01-24 08:37:25.562 +00:00"
2560875040,9484355,Tekan pena gel 0.5mm warna retro pena tangan pulpen grosir bernilai ti,463600.0,0.0,0.0,0,"2022-01-24 08:37:21.131 +00:00"
2560888192,9484355,in Morandi retro warna tekan pena gel pena akun tangan warna kreatif s,433000.0,0.0,0.0,0,"2022-01-24 08:37:21.131 +00:00"
2560906301,9484355,"0.5mmK 35 Tekan gel pena isi ulang bolpoin tanda tangan pena rapat pen",444000.0,0.0,0.0,0,"2022-01-24 08:37:23.829 +00:00"
2560907653,9484355,Tekan pena gel 0.5mm isi ulang hitam K35 siswa belajar tanda tangan pe,410000.0,0.0,0.0,0,"2022-01-24 08:37:24.967 +00:00"
2560914621,9484355,Pena gel Dianshi cepat kering tanda tangan pena antibakteri pegangan l,493000.0,0.0,0.0,0,"2022-01-24 08:37:21.131 +00:00"
2560916892,9484355,Ruang mimpi tekan pena gel siswa menggunakan pena tanda tangan pena be,396600.0,0.0,0.0,0,"2022-01-24 08:37:21.131 +00:00"
2560934201,10038647,"6 Buah Set Kartun Press Gel Pulpen Mahasiswa Ujian Tanda Tangan Hitam",71000.0,0.0,0.0,0,"2022-01-24 08:37:23.829 +00:00"
2560936456,9484355,Jepang ZEBRA Zebra JJ15 Tekan Gel Pena Xueba Hitam Pena Tanda Tangan B,418200.0,0.0,0.0,0,"2022-01-24 08:37:24.492 +00:00"
2560955507,9484355,Kuat tekan pena gel pena tanda tangan ujian siswa hitam segar kecil 0.,540400.0,0.0,0.0,0,"2022-01-24 08:37:21.131 +00:00"
2560958838,9484355,Chenguang tekan pena gel awan perasaan nyaman jabat tangan artefak pek,576700.0,0.0,0.0,0,"2022-01-24 08:37:21.131 +00:00"
2560979194,9484355,Tekan pena gel 0.5mm hitam isi ulang K35 tanda tangan pena pertemuan p,469800.0,0.0,0.0,0,"2022-01-24 08:37:24.492 +00:00"
2561015375,9484355,Tekan pena gel 0.5mm isi ulang pulpen pena tanda tangan pena karbon hi,610680.0,0.0,0.0,0,"2022-01-24 08:37:25.562 +00:00"
2561119389,10038647,"4pcs Pulpen Gel Bentuk Kaktus Untuk Tanda Tangan Kantor Pelajar",64000.0,0.0,0.0,0,"2022-01-24 08:37:21.131 +00:00"
2561570102,10038647,"5 Pcs Set Pena Gel Highlighter Model Tekan Tangan Gaya Retro Untuk Ala",68000.0,0.0,0.0,0,"2022-01-24 08:37:24.967 +00:00"
2561645243,10038647,Pulpen Gel Tinta Hitam Transparan 0.5mm Untuk Tanda Tangan Sekolah,78600.0,0.0,0.0,0,"2022-01-24 08:37:21.131 +00:00"
2561778617,10038647,Sel Pulpen Gel 0.5mm Bahan Metal Untuk Tanda Tangan Kantor Sekolah,78400.0,0.0,0.0,0,"2022-01-24 08:37:23.654 +00:00"
2561813951,10038647,"10pcs Lot Pulpen Gel 0.38mm Lucu Untuk Menulis Tanda Tangan Sekolah",95600.0,0.0,0.0,0,"2022-01-24 08:37:24.803 +00:00"
2561875671,10038647,Goo Pulpen Gel Bentuk Segitiga Bahan Metal Untuk Tanda Tangan Bisnis,85500.0,0.0,0.0,0,"2022-01-24 08:37:23.654 +00:00"
2561917284,10038647,emmoo 0.5mm Morandi Gel Pena Multicolor Gel Pena Tangan Akun Pena Alat,122700.0,0.0,0.0,0,"2022-01-24 08:37:25.376 +00:00"
2562081968,10038647,Gel Pena0.5Tes Siswa Pulpen Kantor Hitam Pena Tanda Tangan Pena Berbas,193000.0,0.0,0.0,0,"2022-01-24 08:37:21.131 +00:00"
2562086020,10038647,Gel Pena0.5Peluru Hitam Ballpoint Pena Tanda Tangan Pena Siswa Ujian K,238000.0,0.0,0.0,0,"2022-01-24 08:37:21.131 +00:00"
2562094986,10038647,Tanda tangan pena pena kantor pena gel counter desktop dapat disisipka,115000.0,0.0,0.0,0,"2022-01-24 08:37:24.803 +00:00"
2562121966,10038647,Pulpen Gel Hitam 0.38mm Model Kartun Korea Untuk Tanda Tangan pelajar,101800.0,0.0,0.0,0,"2022-01-24 08:37:24.803 +00:00"
2562298618,1495113,Sabun Cuci Tangan Biore Guard Gel Eucalyptus Anti Bakteri Botol 200 ml,15000.0,0.0,0.0,4,"2022-01-24 08:37:19.873 +00:00"
2562318940,10038647,"3 Get 1 Free Pulpen Gel 0.5 Warna Merah Muda Untuk Tanda Tangan Guru",227360.0,0.0,0.0,0,"2022-01-24 08:37:25.376 +00:00"
2562319848,10038647,Toko Roti Tekan Warna Gel Pena0.5mmPeluru Tanda Tangan Pena Retro Cata,413000.0,0.0,0.0,0,"2022-01-24 08:37:24.326 +00:00"
2562329102,4710428,YC7888 SILICA GEL PALM support pelindung Pergelangan Tangan.,96900.0,0.0,0.0,0,"2022-01-24 08:37:23.829 +00:00"
2562390964,10038647,Chenqi Gel Pena12PackHitam0.5mmTanda Tangan Pena Bola Peluru Pena Karb,333000.0,0.0,0.0,0,"2022-01-24 08:37:22.728 +00:00"
2562399699,4710428,Mouse Pad Dengan Bantalan Gel Pergelangan Tangan Ergonomis Nyaman Untu,53465.0,0.0,0.0,0,"2022-01-24 08:37:21.466 +00:00"
2562429803,10038647,Gaya cina retro warna tekan batang bulat pena gel akun tangan siswa pe,390300.0,0.0,0.0,0,"2022-01-24 08:37:21.131 +00:00"
2562430423,10038647,Tekan pena gel 0.5m pena air pena bolpoin hitam Pena tanda tangan karb,382400.0,0.0,0.0,0,"2022-01-24 08:37:25.376 +00:00"
2562439170,10038647,in Morandi retro warna tekan pena gel pena akun tangan warna kreatif s,443000.0,0.0,0.0,0,"2022-01-24 08:37:21.131 +00:00"
2562443207,10038647,Tekan pena gel 0.5mm isi ulang pena tanda tangan merah biru dan hitam,453000.0,0.0,0.0,0,"2022-01-24 08:37:25.562 +00:00"
2562447755,10038647,Tekan pena gel 0.5mm isi ulang pulpen pena tanda tangan pena pertemuan,420000.0,0.0,0.0,0,"2022-01-24 08:37:23.654 +00:00"
2562448377,10038647,Tekan pena gel 0.5mm isi ulang hitam K35 siswa belajar tanda tangan pe,420000.0,0.0,0.0,0,"2022-01-24 08:37:24.492 +00:00"
2562449241,10038647,Sederhana tekan pena gel gadis Korea jantung tanda tangan pena kecil s,496000.0,0.0,0.0,0,"2022-01-24 08:37:25.376 +00:00"
2562452495,10038647,Ruang mimpi tekan pena gel siswa menggunakan pena tanda tangan pena be,406600.0,0.0,0.0,0,"2022-01-24 08:37:25.376 +00:00"
2562458804,10038647,Jepang ZEBRA Zebra JJ15 Tekan Gel Pena Xueba Hitam Pena Tanda Tangan B,428200.0,0.0,0.0,0,"2022-01-24 08:37:23.654 +00:00"
2562459066,10038647,Dianshi 060 Press gel pen 0.5mm hitam merah biru pena tanda tangan kan,407900.0,0.0,0.0,0,"2022-01-24 08:37:24.492 +00:00"
2562467444,10038647,Kuat tekan pena gel pena tanda tangan ujian siswa hitam segar kecil 0.,550400.0,0.0,0.0,0,"2022-01-24 08:37:21.131 +00:00"
2562468399,10038647,Chenguang tekan pena gel awan perasaan nyaman jabat tangan artefak pek,586700.0,0.0,0.0,0,"2022-01-24 08:37:21.131 +00:00"
2562478115,10038647,Tekan pena gel 0.5mm hitam isi ulang K35 tanda tangan pena pertemuan p,479800.0,0.0,0.0,0,"2022-01-24 08:37:24.326 +00:00"
2562483571,10038647,Tekan pena gel 0.5 pena air pulpen tanda tangan pena karbon hitam isi,614000.0,0.0,0.0,0,"2022-01-24 08:37:25.562 +00:00"
2562498456,10038647,Bolpoin Gel 0.5mm 10 Warna Gaya Jepang Untuk Tanda Tangan Pelajar,511000.0,0.0,0.0,0,"2022-01-24 08:37:23.829 +00:00"
2562515737,10038647,Efektif Gel Pena Menekan Pena Untuk Siswa0.5mmHitam Pena Tanda Tangan,807320.0,0.0,0.0,0,"2022-01-24 08:37:25.562 +00:00"
2562637776,12625224,TERLARIS Jam Tangan Wanita MK 9180TL Analog Tali Rantai Pasir Free Gel,149000.0,0.0,0.0,0,"2022-01-24 08:37:21.728 +00:00"
2562721458,2156280,Cover Rem Tangan Mobil Universal Bahan Gel Anti Slip,54408.0,0.0,0.0,0,"2022-01-24 08:37:23.829 +00:00"
2563031435,961736,"6 Buah/Set Kartun Press Gel Pulpen Mahasiswa Ujian Tanda Tangan Hitam",81570.0,0.0,0.0,0,"2022-01-24 08:37:21.466 +00:00"
2563693282,9484355,Gelang Perak Berongga Kecil Plum Blossom Bunga Perak Buatan Tangan Gel,59700.0,0.0,0.0,0,"2022-01-24 08:37:24.967 +00:00"
2564171069,4710428,(Strongaroetrtu) Gantungan Kunci Gel Pembersih Tangan Aksen Rumbai Unt,73450.0,0.0,0.0,0,"2022-01-24 08:37:24.140 +00:00"
2564194271,9428203,Cover Rem Tangan Mobil Universal Bahan Silikon Gel Anti Slip,94500.0,0.0,0.0,0,"2022-01-24 08:37:25.713 +00:00"
2564262386,6804723,Silika Gel Car Anti-slip Handbrake Grip Cover Rem Tangan Pelindung Len,115972.0,0.0,0.0,0,"2022-01-24 08:37:21.131 +00:00"
2564282316,961736,Mouse Pad Dengan Bantalan Gel Pergelangan Tangan Ergonomis Nyaman Untu,59333.0,0.0,0.0,0,"2022-01-24 08:37:21.301 +00:00"
2565103251,12625224,Jam Tangan Pria Ori SKMEI Silica Gel Digital Anti Air 10 Bar Jm Tangan,225000.0,0.0,0.0,0,"2022-01-24 08:37:21.728 +00:00"
2565409498,4710428,Mouse Pad Bahan Gel Anti Slip Dengan Bantalan Pergelangan Tangan Untu,128172.0,0.0,0.0,0,"2022-01-24 08:37:22.069 +00:00"
2565990513,6605811,Lucu Kartun Gitar Bentuk Gel Pena Alat Musik Air Hitam Tanda Tangan,77800.0,0.0,0.0,0,"2022-01-24 08:37:24.140 +00:00"
2566066199,961736,(Blesiya2) Bantalan Gel Penyangga Pergelangan Tangan Untuk Mengurangi,90477.0,0.0,0.0,0,"2022-01-24 08:37:21.466 +00:00"
2566183740,6605811,"5 Buah Gel Pena Warna Tangan Akun Macaron Warna Perlengkapan Sekolah",96100.0,0.0,0.0,0,"2022-01-24 08:37:24.140 +00:00"
2566183869,6605811,"6 Buah/Set Kartun Press Gel Pulpen Mahasiswa Ujian Tanda Tangan",102400.0,0.0,0.0,0,"2022-01-24 08:37:23.245 +00:00"
2566339908,6904554,Xianyuan Mouse Pad Dengan Bantalan Pergelangan Tangan Bahan Gel,221600.0,0.0,0.0,0,"2022-01-24 08:37:24.140 +00:00"
2566473903,961736,Mojito Bantalan Gel Nyaman Penyangga Pergelangan Tangan Untuk Keyboard,122864.0,0.0,0.0,0,"2022-01-24 08:37:21.301 +00:00"
2566839613,10038647,Fashion Gelang Tangan dengan Hiasan Berlian Buatan Bergaya Hip Hop gel,64200.0,0.0,0.0,0,"2022-01-24 08:37:24.967 +00:00"
2566887222,10038647,Gelang Perak Berongga Kecil Plum Blossom Bunga Perak Buatan Tangan Gel,69700.0,0.0,0.0,0,"2022-01-24 08:37:24.803 +00:00"
2566986106,8246177,Tolonghot Mouse Pad Dengan Bantalan Pergelangan Tangan Bahan Gel Si,444000.0,0.0,0.0,0,"2022-01-24 08:37:25.713 +00:00"
2567024783,4710428,Bang Mouse Pad Dengan Bantalan Gel Pergelangan Tangan Ergonomis Untuk,108966.0,0.0,0.0,0,"2022-01-24 08:37:22.915 +00:00"
2567418908,961736,(Fcc) Bantalan Gel Penyangga Pergelangan Tangan Untuk Mouse Pad (Card,122303.0,0.0,0.0,0,"2022-01-24 08:37:22.915 +00:00"
2567470721,961736,Mangee Mouse Pad Dengan Bantalan Pergelangan Tangan Bahan Gel Motif T,368616.0,0.0,0.0,0,"2022-01-24 08:37:21.301 +00:00"
2568202808,4710428,Lontime Pulpen Gel 0.5mm Dengan Hiasan Kristal Untuk Tanda Tangan,51041.0,0.0,0.0,0,"2022-01-24 08:37:21.301 +00:00"
2568224994,9484355,Seiko King Kong simpul 4 helai benang giok tenunan tangan horoskop gel,105200.0,0.0,0.0,0,"2022-01-24 08:37:23.829 +00:00"
2568252107,8876689,Sarung Tangan Bersepeda dengan Bantalan Gel Penyerap /Aksesoris sepeda,346500.0,0.0,0.0,0,"2022-01-24 08:37:25.926 +00:00"
2568499482,10272365,Sarung Tangan Sepeda Pearl Izumi Cycling Glove Silicone Gel L,78925.0,0.0,0.0,0,"2022-01-24 08:37:22.915 +00:00"
2568934623,1409714,Sarung Tangan Sepeda Plus GEL Pendek Murah,28000.0,0.0,0.0,2,"2022-01-24 08:37:19.873 +00:00"
2569048591,1271035,Pistol Lem Tangan Termostat 20w Bahan Silica Gel,67000.0,0.0,0.0,0,"2022-01-24 08:37:25.145 +00:00"
2569131375,4710428,Fwid Bantalan Gel Penyangga Pergelangan Tangan Warna Hitam Untuk Keybo,111556.0,0.0,0.0,0,"2022-01-24 08:37:23.082 +00:00"
2569282668,5549554,KP Sarung Tangan Sepeda GEL GIYO AERO,192900.0,0.0,0.0,0,"2022-01-24 08:37:25.145 +00:00"
2569319088,9843420,Sarung Tangan Gloves GiIRO Stradedure Super Gel Original kode mb122,424000.0,0.0,0.0,0,"2022-01-24 08:37:25.376 +00:00"
2570179582,961736,Mouse Pad Dengan Bantalan Pergelangan Tangan Bahan Gel Anti Slip,109696.0,0.0,0.0,0,"2022-01-24 08:37:21.301 +00:00"
2570212216,2156280,Mouse Pad Dengan Bantalan Gel Pergelangan Tangan Ergonomis Nyaman Untu,54179.0,0.0,0.0,0,"2022-01-24 08:37:21.466 +00:00"
2570238481,10798711,Sarung Tangan Olahraga dengan 3D Shockproof Gel,40000.0,0.0,0.0,0,"2022-01-24 08:37:21.728 +00:00"
